'We evaluated the generator on the Penn Treebank <CIT> , which is highly reliable corpus consisting of real-world texts '
'Averaging parameters is a way to reduce overfitting for perceptron training <CIT> , and is applied to all our experiments '
'2 Maximum Entropy Models Maximum entropy -LRB- ME -RRB- models <CIT> , also known as log-linear and exponential learning models , provideageneralpurposemachinelearningtechnique for classification and prediction which has been successfully applied to natural language processing including part of speech tagging , named entity recognition etc Maximum entropy models can integrate features from many heterogeneous information sources for classification '
'1 Introduction State-of-the-art Statistical Machine Translation -LRB- SMT -RRB- systems usually adopt a two-pass search strategy <CIT> as shown in Figure 1 '
'51 The statistical parser The parsing model is the one proposed in Merlo and Musillo <OTH> , which extends the syntactic parser of Henderson <OTH> and <CIT> with annotations which identify semantic role labels , and has competitive performance '
'Study in collocation extraction using lexical statistics has gained some insights to the issues faced in collocation extraction <CIT> '
'Effective training algorithm exists <CIT> once the set of features a42 a57 a16 a1a33a8 a71a54a8 a71a100a85a68a5 a53 is selected '
'There are several distance measures suitable for this purpose , such as the mutual information <CIT> , the dice coefficient <OTH> , the phi coefficient <OTH> , the cosine measure <OTH> and the confidence <OTH> '
'1 Introduction Co-occurrence statistics extracted from corpora lead to good performance on a wide range of tasks that involve the identification of the semantic relation between two words or concepts <CIT> '
'Maximum entropy models <CIT> are a class of exponential models which require no unwarranted independence assumptions and have proven to be very successful in general for integrating information from disparate and possibly overlapping sources '
'Support Vector Machines -LRB- SVMs -RRB- <OTH> and Maximum Entropy -LRB- ME -RRB- method <CIT> are powerful learning methods that satisfy such requirements , and are applied successfully to other NLP tasks <OTH> '
'42 Support Vector Machines We chose to adopt a tagging perspective for the Simple NP chunking task , in which each word is to be tagged as either B , I or O depending on wether it is in the Beginning , Inside , or Outside of the given chunk , an approach first taken by <CIT> , and which has become the de-facto standard for this task '
'In order to overcome this , some unsupervised learning methods and minimally-supervised methods , eg , <CIT> , have been proposed '
'For the current work , the Log-likelihood coefficient has been employed <CIT> , as it is reported to perform well among other scoring methods <OTH> '
'This averaging effect has been shown to help overfitting <CIT> '
'Finally , to estimate the parameters i of the weighted linear model , we adopt the popular minimum error rate training procedure <CIT> which directly optimizes translation quality as measured by the BLEU metric '
'Indeed , researchers have shown that gigantic language models are key to state-ofthe-art performance <CIT> , and the ability of phrase-based decoders to handle large-size , high-order language models with no consequence on asymptotic running time during decoding presents a compelling advantage over CKYdecoders , whosetimecomplexitygrowsprohibitively large with higher-order language models '
'A novel approach was described in <CIT> , which used an unsupervised training technique , extracting relations that were explicitly and unamibiguously signalled and automatically labeling those examples as the training set '
'The bigram translation probability relies on word context , known to be helpful in translation <CIT> , to improve the identification of target phrases '
'It is the most widely reported metric in MT research , and has been shown to correlate well with human judgment <CIT> '
'This means that the 1 -RRB- roblem of recognizing named entities in those cases can be solved by incorporating techniques of base noun phrase chunking <CIT> '
'These models have achieved state-of-the-art performance in transcript-based speech summarization <CIT> '
'1 Introduction Research in language processing has benefited greatly from the collection of large annotated corpora such as Penn PropBank <OTH> and Penn Treebank <CIT> '
'G-Theory and Agreement Indices Two well-known measures for capturing the quality of manual annotations are agreement percentages and the kappa statistic <CIT> '
'The technique of averaging was introduced in the context of perceptrons as an approximation to taking a vote among all the models traversed during training , and has been shown to work well in practice <CIT> '
'2 Confusion-network-based MT system combination The current state-of-the-art is confusion-networkbased MT system combination as described by 98 Rosti and colleagues <CIT> '
'<CIT> successfully used this observation as an approximate annotation technique in an unsupervised WSD model '
'So far , SCL has been applied successfully in NLP for Part-of-Speech tagging and Sentiment Analysis <CIT> '
'4 Experiments Phrase-based SMT systems have been shown to outperform word-based approaches <CIT> '
'21 The <CIT> sparked considerable interest in bootstrapping with his successful method for word sense disambiguation '
'In statistical machine translation , IBM 1 ~ 5 models <CIT> based on the source-chmmel model have been widely used and revised for many language donmins and applications '
'6 Discussion Noting that adding latent features to nonterminals in unlexicalized context-free parsing has been very successful <CIT> , we were surprised not to see a 3Czech experiments were not done , since the number of features -LRB- more than 14 million -RRB- was too high to multiply out by clusters '
'1 Introduction During the last four years , various implementations and extentions to phrase-based statistical models <CIT> have led to significant increases in machine translation accuracy '
'RANDLM <CIT> performs well and scaled to the full data with improvement -LRB- resulting in our best overall system -RRB- '
'Bleu is fast and easy to run , and it can be used as a target function in parameter optimization training procedures that are commonly used in state-of-the-art statistical MT systems <CIT> '
'1 Introduction Over the past decade , there has been tremendous progress on learning parsing models from treebank data <CIT> '
'On the Hansards data , the simple averaging technique described by <CIT> yields a reasonable model '
'With the in-depth study of opinion mining , researchers committed their efforts for more accurate results : the research of sentiment summarization <OTH> , domain transfer problem of the sentiment analysis <CIT> and finegrained opinion mining <OTH> are the main branches of the research of opinion mining '
'Finally , the translation model can be formalized as the following optimization problem argmax logPr -LRB- D ; -RRB- st mwsummationdisplay j = 1 Pr -LRB- wj ok -RRB- = 1 , k This optimization problem can be solved by the EM algorithm <CIT> '
'First , we compared our system output to human reference translations using Bleu <CIT> , a widelyaccepted objective metric for evaluation of machine translations '
'1 Introduction Phrase-based method <CIT> and syntaxbased method <OTH> represent the state-of-the-art technologies in statistical machine translation -LRB- SMT -RRB- '
'According to our experience , the best performance is achieved when the union of the source-to-target and target-to-source alignment sets <CIT> is used for tuple extraction -LRB- some experimental results regarding this issue are presented in Section 422 -RRB- '
'Nonparametricmodels <CIT> may be appropriate '
'6 Related Work The popular IBM models for statistical machine translation are described in <CIT> '
'We use five sentiment classification datasets , including the widely-used movie review dataset -LRB- MOV -RRB- <CIT> as well as four datasets containing reviews of four different types of products from Amazon -LRB- books -LRB- BOO -RRB- , DVDs -LRB- DVD -RRB- , electronics -LRB- ELE -RRB- , and kitchen appliances -LRB- KIT -RRB- -RRB- <OTH> '
'<CIT> shows that baseNP recognition -LRB- Fz = I = 920 -RRB- is easier than finding both NP and VP chunks -LRB- Fz = 1 = 881 -RRB- and that increasing the size of the training data increases the performance on the test set '
'Movies Reviews : This is a popular dataset in sentiment analysis literature <CIT> '
'36 Parameter Estimation To estimate parameters k -LRB- 1 k K -RRB- , lm , and um , we adopt the approach of minimum error rate training -LRB- MERT -RRB- that is popular in SMT <CIT> '
'1 Introduction In recent years , Bracketing Transduction Grammar -LRB- BTG -RRB- proposed by <CIT> has been widely used in statistical machine translation -LRB- SMT -RRB- '
'While significant time savings have already been reported on the basis of automatic pre-tagging -LRB- eg , for POS and parse tree taggings in the Penn TreeBank <CIT> , or named entity taggings for the Genia corpus <OTH> -RRB- , this kind of pre-processing does not reduce the number of text tokens actually to be considered '
'Veale <OTH> used WordNet to answer 374 multiple-choice SAT analogy questions , achieving an accuracy of 43 % , but the best corpus-based approach attains an accuracy of 56 % <CIT> '
'The IOB1 format , introduced in <CIT> , consistently -LRB- : ame out as the best format '
'They were based on mutual information <OTH> , conditional probabilities <OTH> , or on some standard statistical tests , such as the chi-square test or the loglikelihood ratio <CIT> '
'State-of-theart machine learning techniques including Support Vector Machines <OTH> , AdaBoost <OTH> and Maximum Entropy Models <CIT> provide high performance classifiers if one has abundant correctly labeled examples '
'21 The BLEU Metric The metric most often used with MERT is BLEU <CIT> , where the score of a candidate c against a reference translation r is : BLEU = BP -LRB- len -LRB- c -RRB- , len -LRB- r -RRB- -RRB- exp -LRB- 4summationdisplay n = 1 1 4 logpn -RRB- , where pn is the n-gram precision2 and BP is a brevity penalty meant to penalize short outputs , to discourage improving precision at the expense of recall '
'Lexicalization can increase parsing performance dramatically for English <CIT> , and the lexicalized model proposed by Collins -LRB- 1997 -RRB- has been successfully applied to Czech <CIT> and Chinese <OTH> '
'Some NLG researchers are impressed by the success of the BLEU evaluation metric <CIT> in Machine Translation -LRB- MT -RRB- , which has transformed the MT field by allowing researchers to quickly and cheaply evaluate the impact of new ideas , algorithms , and data sets '
'In addition , the averaged parameters technology <CIT> is used to alleviate overfitting and achieve stable performance '
'Successful discriminative parsers have used generative models to reduce training time and raise accuracy above generative baselines <CIT> '
'1 Introduction A hypergraph , as demonstrated by <CIT> , is a compact data-structure that can encode an exponential number of hypotheses generated by a regular phrase-based machine translation -LRB- MT -RRB- system -LRB- eg , Koehn et al '
'<CIT> compares his method to <OTH> and shows that for four words the former performs significantly better in distinguishing between two senses '
'So far , SCL has been applied successfully in NLP for Part-of-Speech tagging and Sentiment Analysis <CIT> '
'1 Introduction With the introduction of the BLEU metric for machine translation evaluation <CIT> , the advantages of doing automatic evaluation for various NLP applications have become increasingly appreciated : they allow for faster implement-evaluate cycles -LRB- by by-passing the human evaluation bottleneck -RRB- , less variation in evaluation performance due to errors in human assessor judgment , and , not least , the possibility of hill-climbing on such metrics in order to improve system performance <OTH> '
'SVM has been shown to be useful for text classification tasks <OTH> , and has previously given good performance in sentiment classification experiments <CIT> '
'Also , in a , state-ofthe-art English parser <CIT> only the words tha , t occur more tha , n d times in training data '
'23 The Averaged Perceptron Reranking Model Averaged perceptron <CIT> has been successfully applied to several tagging and parsing reranking tasks <CIT> , and in this paper , we employed it in reranking semantic parses generated by the base semantic parser SCISSOR '
'One popular and statistically appealing such measure is Log-Likelihood -LRB- LL -RRB- <CIT> '
'Our MT experiments use a re-implementation of Moses <CIT> called Phrasal , which provides an easier API for adding features '
'Recent several years have witnessed the rapid development of system combination methods based on confusion networks -LRB- eg , <CIT> -RRB- , which show state-of-theart performance in MT benchmarks '
'The averaged 1555 perceptron has a solid theoretical fundamental and was proved to be effective across a variety of NLP tasks <CIT> '
'23 Classifier Training We chose maximum entropy <CIT> as our primary classifier , since it had been successfully applied by the highest performing systems in both the SemEval-2007 preposition sense disambiguation task <OTH> and the general word sense disambiguation task <OTH> '
'It could be shown that such methods , of which BLEU <CIT> is the most common , can deliver evaluation results that show a high agreement with human judgments <CIT> '
'The most widely used are Word Error Rate -LRB- WER -RRB- , Position Independent Word Error Rate -LRB- PER -RRB- , the BLEU score <CIT> and the NIST score <OTH> '
'<OTH> has proved to be a simple yet powerful observation and has been successfully used in word sense disambiguation -LRB- WSD -RRB- and related tasks -LRB- eg , <CIT> ; Agirre and Rigau The author was partially funded by GALE DARPA Contract No '
'Furthermore , end-to-end systems like speech recognizers <OTH> and automatic translators <CIT> use increasingly sophisticated discriminative models , which generalize well to new data that is drawn from the same distribution as the training data '
'Moreover , log likelihood ratios are regarded as a more effective method to identify collocations especially when the occurrence count is very low <CIT> '
'After the success in syntactic -LRB- Penn TreeBank <CIT> -RRB- and propositional encodings -LRB- Penn PropBank <OTH> -RRB- , more sophisticated semantic data -LRB- such as temporal <OTH> or opinion annotations <OTH> -RRB- and discourse data -LRB- eg , for anaphora resolution <OTH> and rhetorical parsing <OTH> -RRB- are being generated '
'We choose those sections because several state-of-thwart parsers <CIT> are trained on Section 2-21 and tested on Section 23 '
'441 N-gram Co-Occurrence Statistics for Answer Extraction N-gram co-occurrence statistics have been successfully used in automatic evaluation <CIT> , and more recently as training criteria in statistical machine translation <OTH> '
'However , since work in this direction has started , a significant progress has also been made in the research on statistical learning of full parsers , both in terms of accuracy and processing time <CIT> '
'Phrases extracted using these heuristics are also shown to perform better than syntactically motivated phrases , the joint model , and IBM model 4 <CIT> '
'Recently , various works have improved the quality of statistical machine translation systems by using phrase translation <CIT> '
'He has achieved state-of-the art results by applying ME to parsing <CIT> , part-of-speech tagging <CIT> , and sentence-boundary detection <CIT> '
'There also have been prior work on maintaining approximate counts for higher-order language models -LRB- LMs -RRB- -LRB- <CIT> -RRB- operates under the model that the goal is to store a compressed representation of a disk-resident table of counts and use this compressed representation to answer count queries approximately '
'By default , the log-likelihood ratio measure -LRB- LLR -RRB- is proposed , since it was shown to be particularly suited to language data <CIT> '
'1 Introduction Very large corpora obtained from the Web have been successfully utilized for many natural languageprocessing -LRB- NLP -RRB- applications , suchasprepositional phrase -LRB- PP -RRB- attachment , other-anaphora resolution , spellingcorrection , confusablewordsetdisambiguation and machine translation <CIT> '
'To estimate the parameters of the MEMM + pred model we turn to the successful Maximum Entropy <CIT> parameter estimation method '
'For the full parser , we use the one developed by Michael Collins <CIT> one of the most accurate full parsers around '
'This algorithm appears fairly widely known : it was described by Goodman <OTH> and <CIT> and used by Ding et al -LRB- 2005 -RRB- , and is very similar to other dynamic programming algorithms for CFGs , so we only summarize it here '
'<CIT> -RRB- are best known and studied '
'Introduction The Penn Treebank <CIT> initiated a new paradigm in corpus-based research '
'<CIT> then extended their method and established a sound probabilistic model series , relying on different parameters describing how words within parallel sentences are aligned to each other '
'On the other hand , the best available parsers trained on the Penn Treebank , those of <CIT> and Charniak -LRB- 2000 -RRB- , use statistical models for disambiguation that make crucial use of dependency relations '
'Experiments show that the resulting rule set significantly improves the speed and accuracy over monolingual binarization -LRB- see Table 1 -RRB- in a stateof-the-art syntax-based machine translation system <CIT> '
'An important aspect of web search is to be able to narrow down search results by distinguishing among people with the same name leading to multiple efforts focusing on web person name disambiguation in the literature <CIT> '
'1 Introduction Statistical approaches to machine translation , pioneered by <CIT> , achieved impressive performance by leveraging large amounts of parallel corpora '
'2 Maximum Entropy Models Maximum entropy -LRB- ME -RRB- models <CIT> , also known as log-linear and exponential learning models , provideageneralpurposemachinelearningtechnique for classification and prediction which has been successfully applied to natural language processing including part of speech tagging , named entity recognition etc Maximum entropy models can integrate features from many heterogeneous information sources for classification '
'In this work we use the averaged perceptron algorithm <CIT> since it is an online algorithm much simpler and orders of magnitude faster than Boosting and MaxEnt methods '
'Still , it is in our next plans and part of our future work to embed in our model some of the interesting WSD approaches , like knowledgebased <CIT> , corpus-based <CIT> , or combinations with very high accuracy <OTH> '
'Thus, we obtain the following second-order model: a36a39a38a41a40 a17 a5a7 a42a4 a5a7 a44 a8 a5a57 a15a27a58 a7 a36a39a38a41a40 a17a20a15a59a42a17 a15a41a49 a7 a7 a60 a4 a5a7 a44 a8 ma61a63a62a65a64a33a66 a5a57 a15a27a58 a7a68a67 a40 a17 a15 a42a17 a15a50a49 a7 a15a50a49a51a48 a60 a4 a15a27a47a55a48 a15a50a49a54a48 a44 a11 A well-founded framework for directly modeling the posterior probability a67 a40 a17 a15 a42a17 a15a50a49 a7 a15a50a49a54a48 a60 a4 a15a12a47a55a48 a15a50a49a54a48 a44 is maximum entropy (Berger et al. , 1996).'
'2 Related Work The popular IBM models for statistical machine translation are described in <CIT> and the HMM-based alignment model was introduced in <OTH> '
'In the news article domain , ROUGE scores have been shown to be generally highly correlated with human evaluation in content match <CIT> '
'1 Introduction Phrase-based systems <CIT> are probably the most widespread class of Statistical Machine Translation systems , and arguably one of the most successful '
'21 Log-Linear Models The log-linear model -LRB- LLM -RRB- , or also known as maximum-entropy model <CIT> , is a linear classifier widely used in the NLP literature '
'Although we see statistically significant improvements -LRB- at the 05 level on a paired permutation test -RRB- , the quality of the parsers is still quite poor , in contrast to other applications of bootstrapping which rival supervised methods <CIT> '
'This paper demonstrates several of the characteristics and benefits of SemFrame <CIT> , a system that produces such a resource '
'3 The Perceptron The perceptron algorithm introduced into NLP by <CIT> , is a simple but effective discriminative training method '
'3 CLaC-NB System : Nave Bayes Supervised statistical methods have been very successful in sentiment tagging of texts and in subjectivity detection at sentence level : on movie review texts they reach an accuracy of 85-90 % <CIT> and up to 92 % accuracy on classifying movie review snippets into subjective and objective using both Nave Bayes and SVM <CIT> '
'1 Introduction Raw parallel data need to be preprocessed in the modern phrase-based SMT before they are aligned by alignment algorithms , one of which is the wellknown tool , GIZA + + <CIT> , for training IBM models -LRB- 1-4 -RRB- '
'3 Language modelling with Bloom filters Recentwork <CIT> presenteda scheme for associating static frequency information with a set of n-grams in a BF efficiently1 31 Log-frequency Bloom filter The efficiency of the scheme for storing n-gram statistics within a BF presented in Talbot and Osborne <OTH> relies on the Zipf-like distribution of n-gramfrequencies : mosteventsoccuranextremely small number of times , while a small number are very frequent '
'In the past five years , important research on the automatic acquisition of word classes based on lexical distribution has been published <CIT> '
'Ranking algorithms , such as Kleinbergs HITS algorithm <OTH> or Googles PageRank <OTH> , have been traditionally and successfully used in Web-link analysis <OTH> , social networks , and more recently in text processing applications <CIT> , <CIT> , <OTH> '
'Some notable efforts in this direction for other languages have been the Penn Tree Bank <CIT> for English and the Prague Dependency Bank <OTH> for Czech '
'In informal experiments described elsewhere <OTH> , I found that the G 2 statistic suggested by <CIT> slightly outperforms 2 '
'Introduction The creation of the Penn Treebank <CIT> and the word sense-annotated SEMCOR <OTH> have shown how even limited amounts of annotated data can result in major improvements in complex natural language understanding systems '
'The Penn TreeBank -LRB- PTB -RRB- is an example of such a resource with worldwide impact on natural language processing <CIT> '
'Exponential family models are a mainstay of modern statistical modeling <OTH> and they are widely and successfully used for example in text classification <CIT> '
'1 Introduction Recently linguistically-motivated syntax-based translation method has achieved great success in statistical machine translation -LRB- SMT -RRB- <CIT> '
'The abduction-based approach <CIT> has provided a simple and elegant way to realize such a task '
'Recent comparisons of approaches that can be trained on corpora <OTH> have shown that in most cases statistical aproaches <CIT> yield better results than finite-state , rule-based , or memory-based taggers <OTH> '
'For a full derivation of the modified updates and for quite technical convergence proofs , see <CIT> '
'State-of-the-art measures such as BLEU <CIT> or NIST <OTH> aim at measuring the translation quality rather on the document level1 than on the level of single sentences '
'As a result , the good results of <CIT> with large seed sets do not immediately imply success with small seed sets '
'Its also worth noting that <CIT> saw a LFMS improvement of 08 % over their baseline discriminative parser after adding punctuation features , one of which encoded the sentence-final punctuation '
'It is often straightforward to obtain large amounts of unlabeled data , making semi-supervised approaches appealing ; previous work on semisupervised methods for dependency parsing includes <CIT> '
'In an experiment on 16,800 sentences of Chinese-English newswire text with segment-level human evaluation from the Linguistic Data Consortium?s (LDC) Multiple Translation project, we compare the LFG-based evaluation method with other popular metrics like BLEU, NIST, General Text Matcher (GTM) (Turian et al. , 2003), Translation Error Rate (TER) (Snover et al. , 2006)1, and METEOR (Banerjee and Lavie, 2005), and we show that combining dependency representations with synonyms leads to a more accurate evaluation that correlates better with human judgment.'
'Typical examples of linguistically sophisticated annotation include tagging words with their syntactic category -LRB- although this has not been found to be effective for 1R -RRB- , lemma of the word -LRB- eg ` corpus '' for ` corpora '' -RRB- , phrasal information -LRB- eg identifying noun groups and phrases <OTH> -RRB- , and subject-predicate identification <CIT> '
'Coming from the other direction , such observations about phrase reordering between different languages are precisely thekindsoffactsthatparsingapproachestomachine translation are designed to handle and do successfully handle <CIT> '
'This translation model differs from the well known phrase-based translation approach <CIT> in two basic issues : rst , training data is monotonously segmented into bilingual units ; and second , the model considers n-gram probabilities instead of relative frequencies '
