'The averaged version of the perceptron <CIT> , like the voted perceptron <OTH> , reduces the effect of over-training '
'Since the use of cluster of machines is not always practical , <CIT> showed a randomized data structure called Bloom filter , that can be used to construct space efficient language models 513 for SMT '
'1 Introduction The Maximum Entropy -LRB- ME -RRB- statistical framework <CIT> has been successfully deployed in several NLP tasks '
'To achieve efficient parsing , we use a beam search strategy like the previous methods <CIT> '
'Successflfl examples of reuse of data resources include : the WordNet thesaurus <OTH> ; the Penn Tree Bank <CIT> ; the Longmans Dictionary of Contemporary English <OTH> '
'Averaging has been shown to help reduce overfitting <CIT> '
'Hypergraphs have been successfully used in parsing <CIT> and machine translation <CIT> '
'1 Introduction <CIT> introduced minimum error rate training -LRB- MERT -RRB- for optimizing feature weights in statistical machine translation -LRB- SMT -RRB- models , and demonstrated that it produced higher translation quality scores than maximizing the conditional likelihood of a maximum entropy model using the same features '
'1 Introduction When data have distinct sub-structures , models exploiting latent variables are advantageous in learning <CIT> '
'<CIT> and <OTH> shows how some of the methods which have been used in the past -LRB- particularly mutual information scores -RRB- are invalid for rare events , and introduce accurate measures of how ` surprising '' rare events are '
'Nowadays , most of the state-of-the-art SMT systems are based on bilingual phrases <CIT> '
'In this paper , we show that a noisy channel model instantiated within the paradigm of Statistical Machine Translation -LRB- SMT -RRB- <CIT> can successfully provide editorial assistance for non-native writers '
'However , formally syntax-based methods propose simple but efficient ways to parse and translate sentences <CIT> '
'441 N-gram Co-Occurrence Statistics for Answer Extraction N-gram co-occurrence statistics have been successfully used in automatic evaluation <OTH> , and more recently as training criteria in statistical machine translation <CIT> '
'3 Experimental Results Whereas stochastic modelling is widely used in speech recognition , there are so far only a few research groups that apply stochastic modelling to language translation <CIT> '
'1 Introduction By exploiting information encoded in human-produced syntactic trees <CIT> , research on probabilistic models of syntax has driven the performance of syntactic parsers to about 90 % accuracy <OTH> '
'Unigram models have been previously shown to give good results in sentiment classification tasks <CIT> : unigram representations can capture a variety of lexical combinations and distributions , including those of emotion words '
'The state-of-the art taggers are using feature sets discribed in the corresponding articles -LRB- <OTH> , <OTH> , <OTH> and <CIT> -RRB- , Morce supervised and Morce semi-supervised are using feature set desribed in section 4 '
'It performed slightly worse on baseNP recognition than the <CIT> experiments -LRB- Fz = 1 = 916 -RRB- '
'21 The averaged perceptron The averaged perceptron algorithm <CIT> was proposed as a way of reducing overfitting on the training data '
'In the statistical NLP community , the most widely used grammatical resource is the Penn Treebank <CIT> '
'<OTH> , Pedersen <OTH> , Yarowsky and Florian <OTH> -RRB- as well as maximum entropy models -LRB- eg , Dang and Palmer <OTH> , <CIT> and Manning <OTH> -RRB- in particular have shown a large degree of success for WSD , and have established challenging state-of-the-art benchmarks '
'1 Introduction Large scale annotated corpora such as the Penn TreeBank <CIT> have played a central role in speech and natural language research '
'<CIT> report an improvement in MT grammaticality on a very restricted test set : short sentences parsable by an LFG grammar without back-off rules '
'We carried out automatic evaluation of our summaries using ROUGE <CIT> toolkit , which has been widely adopted by DUC for automatic summarization evaluation '
'In machine translation , confusion-network based combination techniques -LRB- eg , <CIT> -RRB- have achieved the state-of-theart performance in MT evaluations '
'However , except for <CIT> , none of these advances in alignment quality has improved translation quality of a state-of-the-art system '
'In this paper , we build on recent work <CIT> that demonstrated how the Bloom filter -LRB- Bloom -LRB- 1970 -RRB- ; BF -RRB- , a space-efficient randomised data structure for representing sets , could be used to store corpus statistics efficiently '
'Among all the automatic MT evaluation metrics , BLEU <CIT> is the most widely used '
'To simulate real world scenario , we use n-best lists from ISIs state-of-the-art statistical machine translation system , AlTemp <CIT> , and the 2002 NIST Chinese-English evaluation corpus as the test corpus '
'A quite different approach from our hypotheses testing implemented in the TREQ-AL aligner is taken by the model-estimating aligners , most of them relying on the IBM models -LRB- 1 to 5 -RRB- described in the <CIT> seminal paper '
'In our future work we plan to investigate the effect of more sophisticated and , probably , more accurate filtering methods <CIT> on the QA results '
'In Statistical Machine Translation -LRB- SMT -RRB- , recent work shows that WSD helps translation quality when the WSD system directly uses translation candidates as sense inventories <CIT> '
'Most semi-automated approaches have met with limited success <OTH> and supervised learning models have tended to outperform dictionary-based classi cation schemes <CIT> '
'While studies have shown that ratings of MT systems by BLEU and similar metrics correlate well with human judgments <CIT> , we are not aware of any studies that have shown that corpus-based evaluation metrics of NLG systems are correlated with human judgments ; correlation studies have been made of individual components <OTH> , but not of systems '
'While EM has worked quite well for a few tasks , notably machine translations -LRB- starting with the IBM models 1-5 <CIT> , it has not had success in most others , such as part-of-speech tagging <OTH> , named-entity recognition <OTH> and context-free-grammar induction -LRB- numerous attempts , too many to mention -RRB- '
'Incremental top-down and left-corner parsers have been shown to effectively -LRB- and efficiently -RRB- make use of non-local features from the left-context to yield very high accuracy syntactic parses <CIT> , and we will use such rich models to derive our scores '
'Erk <OTH> compared a number of techniques for creating similar-word sets and found that both the Jaccard coefficient and <CIT> s information-theoretic metric work best '
'4 Extended Minimum Error Rate Training Minimum error rate training <CIT> is widely used to optimize feature weights for a linear model <CIT> '
'When we run our classifiers on resource-tight environments such as cell-phones , we can use a random feature mixing technique <CIT> or a memory-efficient trie implementation based on a succinct data structure <OTH> to reduce required memory usage '
'32 Evaluation Criteria Well-established objective evaluation measures like the word error rate -LRB- WER -RRB- , positionindependent word error rate -LRB- PER -RRB- , and the BLEU score <CIT> were used to assess the translation quality '
'In recent several years , the system combination methods based on confusion networks developed rapidly <CIT> , which show state-of-the-art performance in benchmarks '
'Although bi-alignments are known to exhibit high precision <CIT> , in the face of sparse annotations we use unidirectional alignments as a fallback , as has been proposed in the context of phrase-based machine translation <CIT> '
'It is based on Incremental Sigmoid Belief Networks -LRB- ISBNs -RRB- , a class of directed graphical model for structure prediction problems recently proposed in <CIT> , where they were demonstrated to achieve competitive results on the constituent parsing task '
'In our experience , this approach is advantageous in terms of translation quality , eg by 07 % in BLEU compared to a minimum Bayes risk primary <CIT> '
'To solve this problem , we adopt an idea one sense per collocation which was introduced in word sense disambiguation research <CIT> '
'The results show that , as compared to BLEU , several recently proposed metrics such as Semantic-role overlap <OTH> , ParaEval-recall <OTH> , and METEOR <CIT> achieve higher correlation '
'Parsing models have been developed for different languages and state-of-the-art results have been reported for , eg , English <CIT> '
'For English , after a relatively big jump achieved by <CIT> , we have seen two significant improvements : <OTH> and <OTH> pushed the results by a significant amount each time1 1In our final comparison , we have also included the results of <OTH> , because it has surpassed <CIT> as well and we have used this tagger in the data preparation phase '
'However , evaluations on the widely used WSJ corpus of the Penn Treebank <CIT> show that the accuracy of these parsers still lags behind the state-of-theart '
'22 Maximum Entropy Models Maximum entropy -LRB- ME -RRB- models <CIT> , also known as 928 log-linear and exponential learning models , provide a general purpose machine learning technique for classification and prediction which has been successfully applied to natural language processing including part of speech tagging , named entity recognition etc Maximum entropy models can integrate features from many heterogeneous information sources for classification '
'1 Introduction Many state-of-the-art machine translation -LRB- MT -RRB- systems over the past few years <CIT> rely on several models to evaluate the goodness of a given candidate translation in the target language '
'The use of dependencies in MT evaluation has not been extensively researched before -LRB- one exception here would be <CIT> -RRB- , and requires more research to improve it , but the method shows potential to become an accurate evaluation metric '
'Albeit simple , the algorithm has proven to be very efficient and accurate for the task of parse selection <CIT> '
'It is an online training algorithm and has been successfully used in many NLP tasks , such as POS tagging <CIT> , parsing <CIT> , Chinese word segmentation <OTH> , and so on '
'We wish to minimize this error function , so we select accordingly : argmin summationdisplay a E -LRB- a -RRB- -LRB- a , -LRB- argmax a p -LRB- a , f e -RRB- -RRB- -RRB- -LRB- 4 -RRB- Maximizing performance for all of the weights at once is not computationally tractable , but <CIT> has described an efficient one-dimensional search for a similar problem '
'For French\/English translation we use a state of the art phrase-based MT system similar to <CIT> '
'In agreement with recent results on parsing with lexicalised probabilistic grammars <CIT> , our main result is that statistics over lexical features best correspond to independently established truman intuitive preferences and experimental findings '
'Since human evaluation is costly and difficult to do reliably , a major focus of research has been on automatic measures of MT quality , pioneered by BLEU <CIT> and NIST <OTH> '
'It is interesting to note that, while the study of how the granularity of context-free grammars (CFG) affects the performance of a parser (e.g. in the form 86 n1:IP [=] n2:NP [SUBJ=] n4:NR [=] GSC4ES JiangZemin n3:VP [=] n5:VV [=] ESDO interview n6:NP [OBJ=] n7:NR [ADJUNCT] AIC1 Thai n8:NN [=] D3D2 president f1             PRED ESDO SUBJ f2  PRED GSC4ESNTYPE proper NUM sg   OBJ f3       PRED D3D2 NTYPE common NUM sg ADJUNCT   f4  PRED AIC1NTYPE proper NUM sg                         : N  F (n1)=(n3)=(n5)=f1 (n2)=(n4)=f2 (n6)=(n8)=f3 (n7)=f4 Figure 1: Cand f-structures with  links for the sentence GSC4ESESDOAIC1D3D2 of grammar transforms (Johnson, 1998) and lexicalisation (Collins, 1997)) has attracted substantial attention, to our knowledge, there has been a lot less research on this subject for surface realisation, a process that is generally regarded as the reverse process of parsing.'
'The former term P -LRB- E -RRB- is called a language model , representing the likelihood of E The latter term P -LRB- J E -RRB- is called a translation model , representing the generation probability from E into J As an implementation of P -LRB- J E -RRB- , the word alignment based statistical translation <CIT> has been successfully applied to similar language pairs , such as FrenchEnglish and German English , but not to drastically dierent ones , such as JapaneseEnglish '
'The best previous result is an accuracy of 561 % <CIT> '
'1 Introduction Hierarchical approaches to machine translation have proven increasingly successful in recent years <CIT> , and often outperform phrase-based systems <OTH> on target-language fluency and adequacy '
'Throughout , the likelihood ratio <CIT> is used as significance measure because of its stable performance in various evaluations , yet many more measures are possible '
'However , the study of <CIT> provides interesting insights into what makes a good distributional similarity measure in the contexts of semantic similarity prediction and language modeling '
'While <CIT> does not discuss distinguishing more than 2 senses of a word , there is no immediate reason to doubt that the ` one sense per collocation '' rule <CIT> would still hold for a larger number of senses '
'Similarity-based smoothing <CIT> provides an intuitively appealing approach to language modeling '
'<CIT> , which is the classic work on collocation extraction , uses a two-stage filtering model in which , in the first step , n-gram statistics determine possible collocations and , in the second step , these candidates are submitted to a syntactic valida7Of course , lexical material is always at least partially dependent on the domain in question '
'One of the most effective taggers based on a pure HMM is that developed at Xerox <CIT> '
'The success of recent high-quality parsers <CIT> relies on the availability of such treebank corpora '
'Synchronous binarization <CIT> solves this problem by simultaneously binarizing both source and target-sides of a synchronous rule , making sure of contiguous spans on both sides whenever possible '
'<CIT> reported very high results -LRB- 96 % on the Brown corpus -RRB- for unsupervised POS tagging using Hidden Markov Models -LRB- HMMs -RRB- by exploiting hand-built tag dictionaries and equivalence classes '
'All the enumerated segment pairs are listed in the following table : Feature x , y Feature x , y AM1 +1 c1 , c0 AM2 +1 c2c1 , c0 AM1 +2 c1 , c0c1 AM2 +2 c2c1 , c0c1 AM1 +3 c1 , c0c1c2 AM3 +1 c3c2c1 , c0 We use Dunnings method <CIT> because it does not depend on the assumption of normality and it allows comparisons to be made between the signiflcance of the occurrences of both rare and common phenomenon '
'3 Extending Bleu and Ter with Flexible Matching Many widely used metrics like Bleu <CIT> and Ter <OTH> are based on measuring string level similarity between the reference translation and translation hypothesis , just like Meteor Most of them , however , depend on finding exact matches between the words in two strings '
'Promising features might include those over source side reordering rules <OTH> or source context features <CIT> '
'The BLEU metric <CIT> and the closely related NIST metric <OTH> along with WER and PER 48 have been widely used by many machine translation researchers '
'A later study <CIT> found that performance increased to 872 % when considering only those portions of the text deemed to be subjective '
'1 Introduction We have seen rapid recent progress in machine translation through the use of rich features and the development of improved decoding algorithms , often based on grammatical formalisms1 If we view MT as a machine learning problem , features and formalisms imply structural independence assumptions , which are in turn exploited by efficient inference algorithms , including decoders <CIT> '
'Although state-of-the-art statistical parsers <CIT> are more accurate , the simplicity and efficiency of deterministic parsers make them attractive in a number of situations requiring fast , light-weight parsing , or parsing of large amounts of data '
'<CIT> has been unable to find real examples of cases where hierarchical alignment would fail under these conditions , at least in fixed-word-order languages that are lightly inflected , such as English and Chinese -LRB- p 385 -RRB- '
'1 Introduction Phrase-based method <OTH> and syntaxbased method <CIT> represent the state-of-the-art technologies in statistical machine translation -LRB- SMT -RRB- '
'1 Introduction Phrase-based translation <CIT> and hierarchical phrase-based translation <OTH> are the state of the art in statistical machine translation -LRB- SMT -RRB- techniques '
'Although the Kappa coefficient has a number of advantages over percentage agreement -LRB- eg , it takes into account the expected chance interrater agreement ; see <CIT> for details -RRB- , we also report percentage agreement as it allows us to compare straightforwardly the human performance and the automatic methods described below , whose performance will also be reported in terms of percentage agreement '
'Recent innovations have greatly improved the efficiency of language model integration through multipass techniques , such as forest reranking <CIT> , local search <OTH> , and coarse-to-fine pruning <OTH> '
'However , since most of statistical translation models <CIT> are symmetrical , it is relatively easy to train a translation system to translate from English to Chinese , except that weneed to train aChinese language model from the Chinese monolingual data '
'In terms of applying non-parametric Bayesian approaches to NLP , <CIT> evaluated the clustering properties of DPMMs by performing anaphora resolution with good results '
'The full model yields a stateof-the-art BLEU <CIT> score of 08506 on Section 23 of the CCGbank , which is to our knowledge the best score reported to date 410 using a reversible , corpus-engineered grammar '
'They have been successfully applied in several tasks , such as information retrieval <OTH> and harvesting thesauri <CIT> '
'<CIT> showed that the results for French-English were competitive to state-of-the-art alignment systems '
'Another kind of popular approaches to dealing with query translation based on corpus-based techniques uses a parallel corpus containing aligned sentences whose translation pairs are corresponding to each other <CIT> '
'The corpus-based statistical parsing community has many fast and accurate automated parsing systems , including systems produced by <CIT> , Charniak -LRB- 1997 -RRB- and Ratnaparkhi -LRB- 1997 -RRB- '
'Head-lexicalized stochastic grammars have recently become increasingly popular <CIT> '
'Unsupervised algorit ~ m ~ such as <CIT> have reported good accuracy that rivals that of supervised algorithms '
'<CIT> is one of the most famous work that discussed learning polarity from corpus '
'This method , initially proposed by <CIT> , was successfully evaluated in the context of the SENSEVAL framework <OTH> '
'23 Classifier Training We chose maximum entropy <CIT> as our primary classifier because the highest performing systems in both the SemEval-2007 preposition sense disambiguation task <OTH> and the general word sense disambiguation task <OTH> used it '
'Each component model takes the exponential form: a37a55a38a57a56 a51 a42a6a44a59a58a60a56 a61 a51a64a63a65a53a67a66 a53 a45a46a70 a71a16a72a21a73a75a74a77a76a79a78a81a80 a78a16a82a11a78 a38a83a44a59a58a60a56a84a61 a51a64a63a65a53a67a66 a53 a58a60a56 a51 a45a86a85 a87 a38a83a44a59a58a60a56a84a61 a51a64a63a65a53a67a66 a53 a45 a58 (2) where a87 a38a83a44a59a58a60a56 a61 a51a41a63a65a53a67a66 a53 a45 is a normalization term to ensure that a37a55a38a57a56 a51a42a6a44a88a58a60a56a62a61 a51a41a63a65a53a67a66 a53 a45 is a probability, a82a11a78 a38a83a44a59a58a60a56 a61 a51a64a63a65a53a67a66 a53 a58a60a56 a51 a45 is a feature function (often binary) and a80 a78 is the weight ofa82a21a78 . Given a set of features and a corpus of training data, there exist ef cient training algorithms (Darroch and Ratcliff, 1972; Berger et al. , 1996) to nd the optimal parameters a89 a80 a78a14a90 . The art of building a maximum entropy parser then reduces to choosing good features.'
'A variety of classifiers have been employed for this task <OTH> , the most popular being decision lists <CIT> and naive Bayesian classifiers <CIT> '
'2 Related Work Recently , several successful attempts have been made at using supervised machine learning for word alignment <CIT> '
'Pr -LRB- cJ1 , aJ1 eI1 -RRB- = p -LRB- J I -RRB- -LRB- I + 1 -RRB- J Jproductdisplay j = 1 p -LRB- cj eaj -RRB- -LRB- 8 -RRB- 312 Log-likelihood ratio The log-likelihood ratio statistic has been found to be accurate for modeling the associations between rare events <CIT> '
'In contrast , the idea of bootstrapping for relation and information extraction was first proposed in <OTH> , and successfully applied to the construction of semantic lexicons <OTH> , named entity recognition <OTH> , extraction of binary relations <OTH> , and acquisition of structured data for tasks such as Question Answering <CIT> '
'22 Perceptron-based training To tune the parameters w of the model , we use the averaged perceptron algorithm <CIT> because of its efficiency and past success on various NLP tasks <CIT> '
'But in fact , the issue of editing in text summarization has usually been neglected , notable exceptions being the works by <CIT> and Mani , Gates , and Bloedorn -LRB- 1999 -RRB- '
'We also use Cube Pruning algorithm <CIT> to speed up the translation process '
'An important contribution to interactive CAT technology was carried out around the TransType -LRB- TT -RRB- project <CIT> '
'We conclude by noting that English language models currently used in speech recognition <OTH> and automated language translation <CIT> are much more powerful , employing , for example , 7-gram word models -LRB- not letter models -RRB- trained on trillions of words '
'22 ITG Space Inversion Transduction Grammars , or ITGs <CIT> provide an efficient formalism to synchronously parse bitext '
'18 More recently , <CIT> have proposed methods for automatically extracting from a corpus heads that correlate well with discourse novelty '
'A key component of the parsing system is a Maximum Entropy CCG supertagger <CIT> which assigns lexical categories to words in a sentence '
'They provide pairs of phrases that are used to construct a large set of potential translations for each input sentence , along with feature values associated with each phrase pair that are used to select the best translation from this set1 The most widely used method for building phrase translation tables <CIT> selects , from a word alignment of a parallel bilingual training corpus , all pairs of phrases -LRB- up to a given length -RRB- that are consistent with the alignment '
'In the SMT research community , the second step has been well studied and many methods have been proposed to speed up the decoding process , such as node-based or span-based beam search with different pruning strategies <OTH> and cube pruning <CIT> '
'A promising approach may be to use aligned bilingual corpora , especially for augmenting existing lexicons with domain-specific terminology <CIT> '
'It was found to produce automated scores , which strongly correlate with human judgements about translation fluency <CIT> '
'1 Introduction The most widely used alignment model is IBM Model 4 <CIT> '
'We view this as a particularly promising aspect of our work , given that phrase-based systems such as Pharaoh <CIT> perform better with higher recall alignments '
'To facilitate comparisons with previous work <OTH> , we used the training\/development\/test partition defined in the corpus and we also used the automatically-assigned part of speech tags provided in the corpus10 Czech word clusters were derived from the raw text section of the PDT 10 , which contains about 39 million words of newswire text11 We trained the parsers using the averaged perceptron <CIT> , which represents a balance between strong performance and fast training times '
'This kind of corpus has served as an extremely valuable resource for computational linguistics applications such as machine translation and question answering <OTH> , and has also proved useful in theoretical linguistics research <CIT> '
'1 Motivation Statistical part-of-speech disambiguation can be efficiently done with n-gram models <CIT> '
'For the IBM models defined by a pioneering paper <CIT> , a decoding algorithm based on a left-to-right search was described in <OTH> '
'1 Introduction The emergence of phrase-based statistical machine translation -LRB- PSMT -RRB- <CIT> has been one of the major developments in statistical approaches to translation '
'In the supervised setting , a recent paper by <CIT> shows that , using a very simple feature augmentation method coupled with Support Vector Machines , he is able to effectively use both labeled target and source data to provide the best results in a number of NLP tasks '
'Constraining learning by using document boundaries has been used quite effectively in unsupervised word sense disambiguation <CIT> '
'His results may be improved if more sophisticated methods and larger corpora are used to establish similarity between words <CIT> '
'1 Introduction Statistical parsing models have been shown to be successful in recovering labeled constituencies <CIT> and have also been shown to be adequate in recovering dependency relationships <CIT> '
