'A = adjoin , T = attach , C = conjoin , G = generate In this paper , we use the perceptron-like algorithm proposed in <CIT> which does not suffer from the label bias problem , and is fast in training '
'Eigenvector centrality in particular has been successfully applied to many different types of networks , including hyperlinked web pages <OTH> , lexical networks <CIT> , and semantic networks <CIT> '
'Discriminative methods such as Conditional Random Fields -LRB- CRFs -RRB- <OTH> , Semi-Markov Random Fields <OTH> , and perceptrons <CIT> have been popular approaches for sequence labeling because of their excellent performance , which is mainly due to their ability to incorporate many kinds of overlapping and non-independent features '
'First , several of the best-performing parsers on the WSJ treebank <CIT> are cases of history-based models '
'Recently , we can see an important development in natural language processing and computational linguistics towards the use of empirical learning methods -LRB- for instance , <CIT> -RRB- '
'Whereas language generation has benefited from syntax <CIT> , the performance of statistical phrase-based machine translation when relying solely on syntactic phrases has been reported to be poor <OTH> '
'This type of direct optimization is known as Minimum Error Rate Training <CIT> in the MT community , and is an essential component in building the stateof-art MT systems '
'In particular , the use of SVMs in <CIT> initially sparked interest in using machine learning methods for sentiment classi cation '
'Our training and test corpora , for instance , are lessthan-gargantuan compared to such collections as the Penn Treebank <CIT> '
'The IBM models have shown good performance in machine translation , and especially so within certain families of languages , for example in translating between French and English or between Sinhalese and Tamil <CIT> '
'Such word-based lexicalizations of probability models are used successfully in the statistical parsing models of , eg , <CIT> , Charniak -LRB- 1997 -RRB- , or Ratnaparkhi -LRB- 1997 -RRB- '
'To scale LMs to larger corpora with higher-order dependencies , researchers Work completed while this author was at Google Inc have considered alternative parameterizations such as class-based models <OTH> , model reduction techniques such as entropy-based pruning <OTH> , novel represention schemes such as suffix arrays <OTH> , Golomb Coding <OTH> and distributed language models that scale more readily <CIT> '
'Furthermore , use of the self-training techniques described in <CIT> raise this to 878 % -LRB- an error reduction of 28 % -RRB- again without any use of labeled Brown data '
'When efficient techniques have been proposed <CIT> , they have been mostly evaluated on safe pairs of languages where the notion of word is rather clear '
'Note that our result on Dataset A is as strong as that obtained by <CIT> via their subjectivity summarization algorithm , which retains only the subjective portions of a document '
'Several classification models can be adopted here , however , we choose the averaged perceptron algorithm <CIT> because of its simplicity and high accuracy '
'In a later study , <CIT> present a loglinear combination of the HMM and IBM Model 4 that produces better alignments than either of those '
'354 supervised induction techniques that have been successfully developed for English -LRB- eg , Schutze <OTH> , Clark <OTH> -RRB- , including the recentlyproposed prototype-driven approach <CIT> and Bayesian approach <OTH> '
'For example , <CIT> shows that training a learning algorithm on the weighted union of different data sets -LRB- which is basically what we did -RRB- performs almost as well as more involved domain adaptation approaches '
'Similar models have been successfully applied in the past to other tasks including parsing <CIT> , chunking <OTH> , and machine translation <OTH> '
'To perform translation , state-of-the-art MT systems use a statistical phrase-based approach <CIT> by treating phrases as the basic units of translation '
'We also note that there are a number of bootstrapping methods successfully applied to text eg , word sense disambiguation <CIT> , named entity instance classification <OTH> , and the extraction of parts word given the whole word <OTH> '
'2 Motivation and Prior Work While several authors have looked at the supervised adaptation case , there are less -LRB- and especially less successful -RRB- studies on semi-supervised domain adaptation <CIT> '
'The maximum entropy model <CIT> provides us with a well-founded framework for this purpose , which has been extensively used in natural lan guage processing tasks ranging from part-ofspeech tagging to machine translation '
'Here , we use the more established ROUGE-W measure <CIT> instead '
'<CIT> discussed efficient implementation '
'The current state-of-the-art is to optimize these parameters with respect to the final evaluation criterion ; this is the so-called minimum error rate training <CIT> '
'Compared to a basic treebank grammar <OTH> , the grammars of highaccuracy parsers weaken independence assumptions by splitting grammar symbols and rules with either lexical <OTH> or nonlexical <CIT> conditioning information '
'Weight averaging was also employed <CIT> , which helped improve performance '
'As a result of this tuning , our -LRB- fully supervised -RRB- version of the Morce tagger gives the best accuracy among all single taggers for Czech and also very good results for English , being beaten only by the tagger <CIT> -LRB- by 010 % absolute -RRB- and -LRB- not significantly -RRB- by <OTH> '
'One widely used model is the IBM model <CIT> '
'Word segmentation and POS tagging in a joint process have received much attention in recent research and have shown improvements over a pipelined fashion <CIT> '
'Our method follows and substantially extends the earlier work of <CIT> , who use syntactic features and unlabelled dependencies to evaluate MT quality , outperforming BLEU on segment-level correlation with human judgement '
'Among these advances , forest-based modeling <OTH> and tree sequence-based modeling <CIT> are two interesting modeling methods with promising results reported '
'Some recent work on incremental parsing <CIT> showed another way to handle this problem '
'Similar to WSD , <CIT> used contextual information to solve the ambiguity problem for phrases '
'1 Introduction State-of-the-art part of speech -LRB- POS -RRB- tagging accuracy is now above 97 % for newspaper text <CIT> '
'However , the only known work which automates part of a customer service center using natural language dialogue is the one by <CIT> '
'1 Introduction Robust statistical syntactic parsers , made possible by new statistical techniques <OTH> and by the availability of large , hand-annotated training corpora such as WSJ <CIT> and Switchboard <OTH> , have had a major impact on the field of natural language processing '
'For the extraction problem , there have been various methods proposed to date , which are quite adequate <CIT> '
'robust mforrmatlon extractlon, and readlly-avmlable on-hne NLP resources These techtuques and resources allow us to create a richer indexed source of Imgmstlc and domain knowledge than other frequency approaches Our approach attempts to apprommate text dlscourse structure through these multlple layers of mformatlon, ohtinned from automated methods m contrast to labor-lntenslve, discourse-based approaches Moreover, our planned training methodology will also allow us to explmt thin productlve infrastructure m ways whlch model human performance whde avoidmg hand-crafting domain-dependent rules of the knowledge-based approaches Our ultlmate goal m to make our summarlzatlon system scalable and portable by learning summarization rules from easily extractable text features 2 System Description Our summarization system DlmSum consmts of the Summarization Server and the Summarlzatzon Chent The Server extracts features (the Feature Extractor) from a document using various robust NLP techmques, described In Sectzon 2 1, and combines these features (the Feature Combiner) to basehne multiple combinations of features, as described m Section 2 2 Our work m progress to automattcally tram the Feature Combiner based upon user and apphcatlon needs m presented in Section 2 2 2 The Java-based Chent, which wdl be dmcnssed In Section 4, provides a graphical user interface (GUI) for the end user to cnstomlze the summamzatlon preferences and see multiple views of generated sumInarles 2.1 Extracting Stlmmarization Features In this section, we describe how we apply robust NLP technology to extract summarization features Our goal IS to add more mtelhgence to frequencybased approaches, to acqmre domain knowledge In a more automated fashion, and to apprommate text structure by recogmzing sources of dmcourse cohesion and coherence 2.1.1 Going Beyond a Word Frequency-based summarization systems typically use a single word stnng as a umt for counting frequencies Whde such a method IS very robust, it ignores the semantic content of words and their potential membership m multi-word phrases For example, zt does not dmtmgumh between ''bill'' m ''Bdl Table 1 Collocations with ''chlps'' {potato tortdla corn chocolate b~gle} chips {computer pentmm Intel macroprocessor memory} chips {wood oak plastlc} cchlps bsrgmmng clups blue clups mr chips Clmton'' and ''bill'' in ''reform bill'' This may introduce noise m frequency counting as the same strmgs are treated umformly no matter how the context may have dmamblguated the sense or regardless of membership in multl-word phrases For DlrnSum, we use term frequency based on tf*Idf (Salton and McGdl, 1983, Brandow, Mitze, and Rau, 1995) to derive ssgnature words as one of the summarization features If single words were the sole basra of countmg for our summarization application, nome would be introduced both m term frequency and reverse document frequency However, recent advances in statmtlcal NLP and information extraction make it possible to utilize features which go beyond the single word level Our approach is to extract multi-word phrases automatlcally with high accuracy and use them as the basic unit in the summarization process, including frequency calculation Ftrst, just as word association methods have proven effective m lemcal analysis, e g (Church and Hanks, 1990), we are exploring whether frequently occurring Collocatlonal reformation can improve on simple word-based approaches We have preprocessed about 800 MB of LA tlmes/Wastnngton Post newspaper articles nsmg a POS tagger (Bnll, 1993) and derived two-word noun collocations using mutual information The.'
'<CIT> , whose training corpus for the noun drug was 9 times bigger than that of Karov and Edelman , reports 914 % correct performance improved to impressive 939 % when using the ` one sense per discourse '' constraint '
'This increase of probabilities is defined as multiplicative change -LRB- N -RRB- as follows : -LRB- N -RRB- = P -LRB- E Tprime -RRB- \/ P -LRB- E T -RRB- -LRB- 2 -RRB- The main innovation of the model in <CIT> is the possibility of adding at each step the best relation N = -LCB- Ri , j -RCB- as well as N = I -LRB- Ri , j -RRB- that is Ri , j with all the relations by the existing taxonomy '
'However , as also pointed out by <CIT> , this observation does not hold uniformly over all possible co-occurrences of two words '
'The MERT module is a highly modular , efficient and customizable implementation of the algorithm described in <CIT> '
'53 Comparison with SS-CRF-MER When we consider semi-supervised SOL methods , SS-CRF-MER <CIT> is the most competitive with HySOL , since both methods are defined based on CRFs '
'WSD is one of the fundamental problems in natural language processing and is important for applications such as machine translation -LRB- MT -RRB- <CIT> , information retrieval -LRB- IR -RRB- , etc WSD is typically viewed as a classification problem where each ambiguous word is assigned a sense label -LRB- from a pre-defined sense inventory -RRB- during the disambiguation process '
'<CIT> has described an efficient exact onedimensional accuracy maximization technique for a similar search problem in machine translation '
'While these are based on a relatively few number of items, and while we have not performed any tests to determine whether the differences in ? are statistically significant, the results 7The Czech-English conditions were excluded since there were so few systems 146 are nevertheless interesting, since three metrics have higher correlation than Bleu: ??Semantic role overlap (Gimenez and M`arquez, 2007), which makes its debut in the proceedings of this workshop ??ParaEval measuring recall (Zhou et al. , 2006), which has a model of allowable variation in translation that uses automatically generated paraphrases (Callison-Burch, 2007) ??Meteor (Banerjee and Lavie, 2005) which also allows variation by introducing synonyms and by flexibly matches words using stemming.'
'A number of part-of-speech taggers are readily available and widely used , all trained and retrainable on text corpora <CIT> '
'To avoid this problem , we adopt cross-validation training as used in <CIT> '
'The default training set of Penn Treebank <CIT> was used for the parser because the domain and style of those texts actually matches fairly well with the domain and style of the texts on which a reading level predictor for second language learners might be used '
'This source of overcounting is considered and fixed by <CIT> and Zens and Ney -LRB- 2003 -RRB- , which we briefly review here '
'This further supports the claim by <CIT> that loglikelihood ratio is much less sensitive than pmi to low counts '
'Inversion transduction grammar <CIT> , or ITG , is a wellstudied synchronous grammar formalism '
'For example , <CIT> used cooccurrences between verbs and their subjects and objects , and proposed a similarity metric based on mutual information , but no exploration concerning the effectiveness of other kinds of word relationship is provided , although it is extendable to any kinds of contextual information '
'Studies on the supervised task have shown that straightforward baselines -LRB- eg models based on source only , target only , or the union of the data -RRB- achieve a relatively high performance level and are surprisingly difficult to beat <CIT> '
'Results from <CIT> show that under these definitions the following guarantee holds : LogLossUpda , k , BestWtk , a C20 BestLossk , a So it can be seen that the update from a to Upda , k , BestWtk , a is guaranteed to decrease LogLoss by at least W k q C0 W C0 k qC16C17 2 From these results , the algorithms in Figures 3 and 4 could be altered to take the revised definitions of W k and W C0 k into account '
'The notion of incrementally merging classes of lexical items is intuitively satisfying and is explored in detail in <CIT> '
'61 Interand Intra-annotator agreement We measured pairwise agreement among annotators usingthekappacoefficient -LRB- K -RRB- whichiswidelyused in computational linguistics for measuring agreement in category judgments <CIT> '
'In the supervised setting , a recent paper by <CIT> shows that a simple feature augmentation method for SVM is able to effectively use both labeled target and source data to provide the best domainadaptation results in a number of NLP tasks '
'To speed our computations , we use the cube pruning method of <CIT> with a fixed beam size '
'<CIT> information-theoretic similarity measure is commonly used in lexicon acquisition tasks and has demonstrated good performance in unsupervised WSD <OTH> '
'1 Introduction State-of-the-art Statistical Machine Translation -LRB- SMT -RRB- systems usually adopt a two-pass search strategy <CIT> as shown in Figure 1 '
'Following <CIT> we can avoid unnecessary false positives by not querying for the longer n-gram in such cases '
'It is explored extensively in <CIT> '
'We compare semisupervised LEAF with a previous state of the art semi-supervised system <CIT> '
'The main application of these techniques to written input has been in the robust , lexical tagging of corpora with part-of-speech labels <CIT> '
'2 Head Lexicalization As previously shown -LRB- Charniak <OTH> , <CIT> <OTH> , Carroll and Rooth -LRB- 1998 -RRB- , etc -RRB- , ContextFree Grammars -LRB- CFGs -RRB- can be transformed to lexicalized CFGs , provided that a head-marking scheme for rules is given '
'Other well-known metrics are WER <OTH> , NIST <OTH> , GTM <OTH> , ROUGE <OTH> , METEOR <CIT> , and TER <OTH> , just to name a few '
'Studies reveal that statistical alignment models outperform the simple Dice coefficient <CIT> '
'One possible approach is to employ state-of-the-art techniques for coreference and zeroanaphora resolution <CIT> in preprocessing cooccurrence samples '
'The evaluation results also confirm the argument of <CIT> , who suggested G2 as a more robust alternative to X2 '
'We decided to use the class of maximum entropy models , which are probabilistically sound , can make use of possibly many overlapping features , and can be trained efficiently <CIT> '
'Whereas dependency based semantic spaces have been shown to surpass other word space models for a number of problems <CIT> , for the task of categorisation simple pattern based spaces have been shown to perform equally good if not better <OTH> '
'In addition , parsing re-ranking <CIT> has also been shown to be another effective technique to improve parsing performance '
'However , attempts to retrofit syntactic information into the phrase-based paradigm have not met with enormous success <CIT> 1 , and purely phrase-based machine translation systems continue to outperform these syntax\/phrase-based hybrids '
'In their seminal paper on SMT , Brownand his colleagues highlighted the problems weface aswe go from IBM Models 1-2 to 3-5 <CIT> 3 : Asweprogress from Model1toModel5 , evaluating the expectations that gives us counts becomes increasingly difficult '
'1 Introduction Phrase-based modeling method <CIT> is a simple , but powerful mechanism to machine translation since it can model local reorderings and translations of multiword expressions well '
'And again , we see this insight informing statistical machine translation systems , for instance , in the phrase-based approaches of Och <OTH> and <CIT> et al '
'<CIT> reports interesting results of this kind based on literal collocations , where he parses the corpus <CIT> into predicate-argument structures and applies a mutual information measure <OTH> to weigh the association between the predicate and each of its arguments '
'31 A History-Based Model The history-based -LRB- HB -RRB- approach which incorporates more context information has worked well in parsing <CIT> '
'In previous work <OTH> , I described a Maximum Entropy\/Minimum Divergence -LRB- MEMD -RRB- model <OTH> for p -LRB- w -LRB- hi , s -RRB- which incorporates a trigram language model and a translation component which is an analog of the well-known IBM translation model 1 <CIT> '
'a list of pilot terms ranked from the most representative of the corpus to the least thanks to the Loglikelihood coefficient introduced by <CIT> '
'This paper is heavily indebted to prior work on unsupervised learning of position categories such as <CIT> et al 1992 , Schtze 1997 , Higgins 2002 , and others cited there '
'Recent work by <CIT> shows a practically ef cient approach that binarizes linguistically SCFG rules when possible '
'Among the grammar formalisms successfully put into use in syntaxbased SMT are synchronous context-free grammars -LRB- SCFG -RRB- <CIT> and synchronous treesubstitutiongrammars -LRB- STSG -RRB- <OTH> '
'Hidden Markov models are simple and effective , but unlike discriminative models , such as Maximum Entropy models <CIT> and Conditional Random Fields <OTH> , they have more difficulty utilizing a rich set of conditionally dependent features '
'8Interestingly , in work on the automated classification of nouns , <CIT> also noted problems with ''em pty '' words that depend on their complements for meaning '
'Several studies have reported alignment or translation performance for syntactically augmented translation models <CIT> and these results have been promising '
'22 Perceptron-based training To tune the parameters w of the model , we use the averaged perceptron algorithm <CIT> because of its efficiency and past success on various NLP tasks <CIT> '
'For French\/English translation we use a state of the art phrase-based MT system similar to <CIT> '
'Maximum entropy taggers have been shown to be highly competitive on a number of tagging tasks , such as partof-speech tagging <CIT> , and namedentity recognition -LRB- Borthwick et '
'Lexicalized PCFGs use the structural features on the lexical head of phrasal node in a tree , and get significant improvements for parsing <CIT> '
'The most widely used single-word-based statistical alignment models -LRB- SAMs -RRB- have been proposed in <CIT> '
'Decision lists have already been successfully applied to lexical ambiguity resolution by <CIT> where they perfromed well '
'Some of the more popular and more accurate of these approaches to data-driven parsing <CIT> have been based on generative models that are closely related to probabilistic contextfree grammars '
'Indeed , recent work has shown that benefits can be made by first separating facts from opinions in a document -LRB- eg , Yu and Hatzivassiloglou <OTH> -RRB- and classifying the polarity based solely on the subjective portions of the document -LRB- eg , <CIT> -RRB- '
'1 Introduction Chinese Word Segmentation -LRB- CWS -RRB- has been witnessed a prominent progress in the last three Bakeoffs <OTH> , <OTH> , <CIT> '
'Of particular interest are lexicalized parsing models such as the ones developed by <CIT> and Carroll and Rooth -LRB- 1998 -RRB- '
'Recently , graph-based methods have proved useful for a number of NLP and IR tasks such as document re-ranking in ad hoc IR <OTH> and analyzing sentiments in text <CIT> '
'For English , after a relatively big jump achieved by <OTH> , we have seen two significant improvements : <OTH> and <CIT> pushed the results by a significant amount each time1 1In our final comparison , we have also included the results of <OTH> , because it has surpassed <OTH> as well and we have used this tagger in the data preparation phase '
'The <CIT> algorithm was one of the first bootstrapping algorithms to become widely known in computational linguistics '
'Another widely used discriminative method is the perceptron algorithm <CIT> , which achieves comparable performance to CRFs with much faster training , so we base this work on the perceptron '
'For symmetrization , we found that Och and Neys refined technique described in <CIT> produced the best AER for this data set under all experimental conditions '
'Ramshaw and Marcus <CIT> successflflly applied Eric Brill ''s transformation-based learning method to the chunking problem '
'METEOR uses the Porter stemmer and synonymmatching via WordNet to calculate recall and precision more accurately <CIT> '
'Recent work <CIT> has demonstrated that randomized encodings can be used to represent n-gram counts for LMs with signficant space-savings , circumventing information-theoretic constraints on lossless data structures by allowing errors with some small probability '
'Also , slightly restating the advantages of phrase-pairs identified in <CIT> , these blocks are effective at capturing context including the encoding of non-compositional phrase pairs , and capturing local reordering , but they lack variables -LRB- eg embedding between ne pas in French -RRB- , have sparsity problems , and lack a strategy for global reordering '
'The efficient block alignment algorithm in Section 4 is related to the inversion transduction grammar approach to bilingual parsing described in <CIT> : in both cases the number of alignments is drastically reduced by introducing appropriate re-ordering restrictions '
'3 System Overview 31 Translation model The system developed for this years shared task is a state-of-the-art , two-pass phrase-based statistical machine translation system based on a log-linear translation model <CIT> '
'Introduction Automatic word alignment <CIT> is a vital component of all statistical machine translation -LRB- SMT -RRB- approaches '
'4 Data and Evaluation For the CoNLL shared task , we have chosen to work with the same sections of the Penn Treebank as the widely used data set for base noun phrase recognition <CIT> : WSJ sections 15-18 of the Penn Treebank as training material and section 20 as test material 3 '
'Many efficient techniques exist to extract multiword expressions , collocations , lexical units and idioms <CIT> '
'1 Introduction The maximum entropy model <CIT> has attained great popularity in the NLP field due to its power , robustness , and successful performance in various NLP tasks <OTH> '
'This was recently followed by <CIT> who introduce state-of-the-art nearly unlexicalized PCFG parsers '
'Recent comparisons of approaches that can be trained on corpora <OTH> have shown that in most cases statistical aproaches <CIT> yield better results than finite-state , rule-based , or memory-based taggers <OTH> '
'Nowadays , most state-of-the-art SMT systems are based on bilingual phrases <CIT> '
'52 Results We use a Maximum Entropy -LRB- ME -RRB- classi er <CIT> which allows an e cient combination of many overlapping features '
'1 Introduction Syntactic methods are an increasingly promising approach to statistical machine translation , being both algorithmically appealing <CIT> and empirically successful <OTH> '
'3 Perceptron Reranking As <CIT> observes , perceptron training involves a simple , on-line algorithm , with few iterations typically required to achieve good performance '
