" uilding on a recent proposal in this direction by Turney (2008), we propose a generic method of this sort, and we test it on a set of unrelated tasks, reporting good performance across the board with very little task-specific tweaking. "
"Turney (2008) is the first, to the best of our knowledge, to raise the issue of a unified approach. In particular, he treats synonymy and association as special cases of relational similarity "
"Mirkinet al. 2006 also integrate information from the lexical patterns in which two words co-occur and similarity of the contexts in which each word occurs on its own, to improve performance in lexical entailment Acquisition. "
The first task we evaluated our algorithm on is the SAT analogy questions task introduced by Turney et al. (2003).
We adopt a similar approach to the one used in Turney (2008) and consider each question as a separate binary classification problem with one positive training instance and 5 unknown pairs. 
"Specifically, we test selectional preferences on the dataset constructed by Padó (2007), that collects average plausibility judgments (from 20 speakers) for nouns as either subjects or objects of verbs (211 noun-verb pairs). "
"Thus, corpus-based approaches may have serious difficulties in capturing these relations (Havasi et al., 2007), but there are reasons to believe that they could still be useful: Eslick (2006) uses the assertions of ConceptNet as seeds to parse Web search results and augment ConceptNet by new candidate relations."
"Fortunately, using distributional characteristics of term contexts, it is feasible to induce part-of-speech categories directly from a corpus of sufficient size, as several papers have made clear (Brown et al., 1992; Schütze, 1993; Clark, 2000). "
"There are many applications of computational linguistics, particularly those involving “shallow” processing, such as information extraction, which can benefit from such automatically derived information, especially as research into acquisition of grammar matures (e.g., (Clark, 2001))."
"Our approach to inducing syntactic clusters is closely related to that described in Brown, et al, (1992) which is one of the earliest papers on the subject. "
"We seek to find a partition of the vocabulary that maximizes the mutual information between term categories and their contexts. We achieve this in the framework of information theoretic co-clustering (Dhillon et al., 2003), in which a space of entities, on the one hand, and their contexts, on the other, are alternately clustered in a way that maximizes mutual information between the two spaces."
"We conducted experiments with the Reuters-21578 Corpus a relatively tiny one for such experiments. Clark (2000) reports results on a corpus containing 12 million terms, Schütze (1993) on one containing 25 million terms, and Brown, et al, (1992) on one containing 365 million terms. In contrast, we count approximately 2.8 million terms in Reuters-21578."
Schütze ( 1993; 1995)proposes two distinct methods by which ambiguity may be resolved. 
"Most state-of-the-art system combination methods are based on constructing a confusion network (CN) from several input translation hypotheses, and choosing the best output from the CN based on several scoring functions (e.g. Rosti et. al., 2007a, He et. al., 2008, Matusov et al. 2008)."
"Prior work has used a number of heuristics to deal with these problems (Matusov, et. al., 2006, He et al 08). Some work has made such decisions in a more principled fashion by computing model-based scores (Matusov et al. 2008), but still special- purpose algorithms and heuristics are needed and a single alignment is fixed."
"Other than confusion-network-based algorithms, work most closely related to ours is the method of MT system combination proposed in (Jayaraman and Lavie 2005), which we will refer to as J&L."
"If one of the two words is ε, the posterior of aligning word ε to state j is computed as suggested by Liang et al. (2006)"
"Raw text is processed by a preprocessor which segments the text into sentences using various heuristics about punctuation, and then to- kenizes and runs it through a wide-coverage high performance morphological analyzer developed using two-level morphology tools by Xerox (Kart- Tunen, 1993). "
"However, the use of regular relations and finite state transducers (Kaplan and Kay, 1994) provide a very efficient implementation Method. "
"We have recently completed a prototype implementation of this approach (in C) for English (Brown Corpus) and have obtained quite similar results (Tiir, Of- lazer, and Oz-kan, 1997). "
"The convenience of adding new rules in without worrying about where exactly it goes in terms of rule ordering (something that hampered our progress in our earlier work on disambiguating Turkish morphology (Oflazer and KuruSz, 1994; Oflazer and Tiir, 1996)), has also been a key positive point. "
"This has been quite useful for our work on tagging English (Tfir, Oflazer, and 0z-kan, 1997) where such rules with negative weights were used to fine tune the behavior of the tagger in various prob- lematic cases. "
"While many text categorization models have been proposed so far, in this paper, we concentrate on the probabilistic models (Robertson and Sparck Jones, 1976; Kwok, 1990; Fuhr, 1989; Lewis, 1992; Croft, 1981; Wong and Yao, 1989; Yu et al., 1989) because these models have solid formal grounding in probability theory. "
Robertson and Sparck Jones (1976) make use of the well-known logistic (or log-odds) transformation of the probability P(c]d). 
"In general, frequently appearing terms in a document play an important role in information retrieval (Salton and McGill, 1983). Salton and Yang experimentally verified the importance of within-document term frequencies in their vector model (Salton and Yang, 1973). "
"A well-known remedy for this problem is to use (r + 0.5)/(R + 1) as the estimate of P(T = lie ) (Robertson and Sparck Jones, 1976). While various smoothing methods (Church and Gale, 1991; Jelinek, 1990) are also applicable to these situations and would be expected to work better, we used the simple ""add one"" remedy in the following experiments."
"To solve problems 1 and 2 of PRW, Kwok (1990) stresses the assumption that a document consists of terms. This theory is called the Component Theory (CT). "
Fuhr (1989) solves problem 2 by assuming that a document is probabilistically indexed by its term vectors. This model is called Retrieval with Probabilistie Indexing (RPI). 
"There are several strategies for assigning categories to a document based on the probability P(cld ). The simplest one is the k-per-doc strategy (Field, 1975) that assigns the top k categories to each document. "
"We have to compare our probabilistic model to other non probabilistic models like decision tree/rule based models, one of which has recently been reported to be promising (Apt4 et al., 1994). "
"While we used simple document representation in which a document is defined as a set of nouns, there could be considered several improvements, such as using phrasal information (Lewis, 1992), clustering terms (Sparck Jones, 1973), reducing the number of features by using local dictionary (Apt4 et al., 1994), etc. "
"If we need to generate summaries that can be used to indicative what topics are addressed in the original document, and thus can be used to alert the uses as the source content, i.e., the indicative function (Mani et al., 1999), extraction approach is capable of handling this kind of tasks. "
"A comprehensive survey of text summarization approaches can be found in (Mani, 1999). We briefly review here based on extraction approach. Luhn (1959) proposed a simple but effective approach by using term frequencies and their related positions to weight sentences that are extracted to form a summary."
The first known supervised learning algorithm was proposed by Kupiec et al. (1995). Their approach estimates the probability that a sentence should be included in a summary given its feature values based on the independent assumption of Bayes’ Rule. 
"In order to determine word boundaries, we employed the longest matching algorithm (Sornlertlamvanich, 1993). "
"We further describe an efficient approach to alleviate this problem by using an idea of phrase construction (Ohsawa et al., 1998). "
"Our approach is reminiscent of Luhn’s approach (1959) but uses the other term weighting technique instead of the term frequency. Luhn suggested that the frequency of a word occurrence in a document, as well as its relative position determines its significance in that document. "
"More recent works have also employed Luhn’s approach as a basis component for extracting relevant sentences (Buyukkokten et al.,2001; Lam- desina and Jones, 2001). This approach performs well despite of its simplicity. In our previous work (Jaruskulchai et al., 2003), we also applied this approach for summarizing and browsing Thai documents through PDAs. "
"In our work, we decide to use TLTF (Term Length Term Frequency) term weighting technique (Banko et al., 1999) for scoring words in the document instead of TFIDF. "
"The recent approach for editing extracted text spans (Jing and McKeown, 2000) may also produce improvement for our algorithm."
"This assumption underlies a growing number of recent syntactic theories which give up the context-free constituent ba.ckbone, cf. (McCawley, 1987), (Dowty, 1989), (Reape, 1993), (Kathol and Pollard, 1995). These approaches provide an adequate explanation for several issues problematic ibr phrase-structure g r a m m a r s (clause union, extraposition, diverse second-position phenomena). "
Jing and McKeown (1999; 2000) found that human summarization can be traced back to six cut-and-paste operations of a text and proposed a revision method consisting of sentence reduction and combination modules with a sentence extraction part. Mani and colleagues (1999) proposed a summarization system based on “draft and revision” together with sentence extraction. The revision part is achieved with the sentence aggregation and smoothing modules. 
"To ameliorate this, revision of the extracted sentences is also thought to be effective, and many ideas and methods have been proposed so far. For example, Otterbacher and colleagues (2002) analyzed manually revised extracts and factored out cohesion problems. Nenkova (2008) proposed a revision idea that utilizes noun coreference with linguistic quality improvements in mind."
Barzilay and McKeown (2005) proposed an idea called sentence fusion that integrates information in overlapping sentences to produce a non- overlapping summary sentence. 
Their algorithm was further modified and applied to the German biographies by Filippova and Strube (2008)
"Like the work of Jing and McKeown (2000) and Mani et al. (1999), our work was inspired by the summarization method used by human abstractors."
"Identifying our coreferential chunks is even harder than the conventional coreference resolution, and we made a simplifying assumption as in Nenkova (2008) with some additional conditions that were obtained through our preliminary experiments "
"The paper presents an application of Structural Correspondence Learning (SCL) (Blitzer et al., 2006) for domain adaptation of a stochastic attribute-value grammar (SAVG). So far, SCL has been applied successfully in NLP for Part-of-Speech tagging and Sentiment Analysis (Blitzer et al., 2006; Blitzer et al., 2007). "
"Studies on the supervised task have shown that straightforward baselines (e.g. models based on source only, target only, or the union of the data) achieve a relatively high performance level and are “surprisingly difficult to beat” (Daumé III, 2007).  "
"While several authors have looked at the supervised adaptation case, there are less (and especially less successful) studies on semi-supervised domain adaptation (McClosky et al., 2006; Blitzer et al., 2006; Dredze et al., 2007). Of these, McClosky et al. (2006) deal specifically with self training for data-driven statistical parsing. They show that together with a re-ranker, improvements are obtained. Similarly, Structural Correspondence Learning (Blitzer et al., 2006; Blitzer et al., 2007; Blitzer, 2008) has proven to be successful for the two tasks examined, PoS tagging and Sentiment Classification."
"The few studies on adapting disambiguation models (Hara et al., 2005; Plank and van Noord, 2008) have focused exclusively on the supervised scenario."
"We examine the effectiveness of Structural Correspondence Learning (SCL) (Blitzer et al., 2006) for this task, a recently proposed adaptation technique shown to be effective for PoS tagging and Sentiment Analysis. The system used in this study is Alpino, a wide-coverage Stochastic Attribute Value Grammar (SAVG) for Dutch (van Noord and Malouf, 2005; van Noord, 2006). "
"Alpino (van Noord and Malouf, 2005; van Noord, 2006) is a robust computational analyzer for Dutch that implements the conceptual two-stage parsing Approach. "
"Pivots are features occurring frequently and behaving similarly in both domains (Blitzer et al., 2006). They are inspired by auxiliary problems from Ando and Zhang (2005)."
"This allows us to get a possibly noisy, but more abstract representation of the underlying data. The set of features used in Alpino is further described in van Noord and Malouf (2005)."
"In practice, there are more free parameters and model choices (Ando and Zhang, 2005; Ando, 2006; Blitzer et al., 2006; Blitzer, 2008) besides the ones discussed above."
"Due to the positive results in Ando (2006), Blitzer et al. (2006) include this in their standard setting of SCL and report results using block SVDs only. "
"If we want to compare the performance of disambiguation models, we can employ the φ mesure (van Noord and Malouf, 2005; van Noord, 2007). Intuitively, it tells us how much of the disambiguation problem has been solved. "
"(Church, 1992) claims that part-of-speech taggers depend almost exclusively on lexical probabilities, whereas other researchers, such as Voutilainen (Karlsson et al., 1995) argue that word ambiguities vary widely in function of the specific text and genre. Indeed, part of Church's argument is relevant if a system is based on a large corpus such as the Brown corpus (Francis and Ku~era, 1982) which represents one million surface forms of morpho-syntacticaJly disambiguated words from a range of balanced texts. "
"Given the problems created by estimating probabilities on a corpus of restricted size, we present in Section 4 a solution for coping with these difficulties. We suggest a new paradigm called genotype , derived from the concept of ambiguity class (Kupiec, 1992), which gives a more efficient representation of the data in order to achieve more accuracy in part-of-speech disambiguation. "
"(Brill, 1995) presents a rule-based part-of-speech tagger for unsupervised training corpus. Some of the rules of his system and the fact that he uses a minimal training corpus suggests some similarities with our system, but the main aim of the work is to investigate methods to combine supervised and unsupervised training in order to come up with a highly performing tagger. "
"Summarization of such texts requires a different approach from, for example, that used in the summarization of news articles. For example, Barzilay, McKeown, and Elhadad (1999) introduce the concept of information fusion, which is based on the identification of re- curren  description of the same events in news articles. This approach works well because in the news domain, newsworthy events are frequently repeated over a short period of time. In scientific writing, however, similar “events” are rare  "
Metadiscourse is ubiquitous in scientific writing: Hyland (1998) found a metadiscourse phrase on average after every 15 words in running text. 
"Paice (1990) introduces grammars for pattern matching of indicator phrases, e.g., the aim/purpose of this paper/article/study and we conclude/propose. "
This heterogeneity is in stark contrast to the systematic structures Liddy (1991) found to be produced by professional abstractors.  
"A simpler machine learning approach using only word frequency information and no other features, as typically used in tasks like text classification, could have been employed (and indeed Nanba and Okumura [1999] do so for classifying citation Contexts). "
"For the task of dialogue act disambiguation, Samuel, Carberry, and Vijay-Shanker (1999) suggest a method of automatically finding cue phrases for disambiguation. It may be possible to apply this or a similar method to our data and to compare the performance of automatically gained resources with manual ones. "
"Resnik and Diab (2000) present yet other measures of verb similarity, which could be used to arrive at a more data-driven definition of verb classes. "
"We also plan to consider reasonable applications for semantic tagging. One possibility would be to use semantic tagging in the framework of an intelligent on line dictionary lookup such as LocoLex [Bauer et al, 1995]. "
"The learning corpus can consist of plain text, but the best results seem achievable with annotated corpora (Merialdo 1994; Elworthy 1994). "
"With respect to computational morphology, witness for instance the success of the Two-Level paradigm introduced by Koskenniemi (1983) "
"Before proceeding further with the main argument, consider three very recent hybrids – systems that employ linguistic rules for resolving some of the ambiguities before using automatically generated corpus-based information: collocation matrices (Leech, Garside and Bryant 1994), Hidden Markov Models (Tapanainen and Voutilai- nen 1994), or syntactic patterns (Tapanainen and Jairvinen 1994).   "
"Functional representation of phrases and clauses has been introduced to facilitate expressing syntactic generMisations. The representation is introduced in (Voutilainen and Tapanainen 1993; Voutilainen 1994); here, only the main characteristics are given "
"A small error ratehas been achieved by such systems when a restricted, application-dependent POS setis used; e.g., an error rate of 2-6 percent has been reported by Marcus, Santorini, andMarcinkiewicz (1993) using the Penn Treebank corpus."
"Recently, several solutions to the problem of tagging unknown words have beenpresented (Charniak et al. 1993; Meteer, Schwartz, and Weischedel 1991)."
"Hypothesesfor unknown words, both stochastic (Dermatas and Kokkinakis 1993, 1994; Malteseand Mancini 1991; Weischedel et al. 1993), and connectionist (Eineborg and Gamback1993; Elenius 1990) have been applied to unlimited vocabulary taggers."
Various interpolation techniques have been proposed for the estimationof the model parameters for unseen events or to smooth the modelparameters (Church and Gale 1991; Essen and Steinbiss 1992; Jardinoand Adda 1993; Katz 1987; McInnes 1992).
"For more details on the linguistic specifications of the annotation scheme see (Skut et al 1997). A similar approach has been also successfully applied in the T S N L P database, cf. (Lehmann et al 1996). "
"Experience gained from the development of the Penn Treebank (Marcus et al., 1994) has shown that automatic annotation is useful only if it is absolutely correct, while wrong analyses are often difficult to detect and their correction can be time-consuming. "
"The work reported here is a logical continuation of two specific strands of research aimed in this general direction. The first is the popular idea of statistical tagging e.g. (DeRose, 1988; Cutting et al., 1992; Church, 1988). "
"In the specific case of part-of-speech tagging, it is well-known (DeMarcken, 1990) that a large proportion of the incorrect tags can be eliminated safely i.e. with very low risk of eliminating correct tags. "
"This part of the paper is essentially an extension and generalization of the line of work described in (Rayner, 1988; Rayner and Samuelsson, 1990; Samuelsson and Rayner, 1991; Rayner and Samuels- son, 1994; Samuelsson, 1994b). "
"The result is a ""specialized"" grammar; this has a larger number of rules, but a simpler structure, allowing it in practice to be parsed very much more quickly using an LR- based method (Samuelsson, 1994a). "
"In the second phase, the resulting set of ""chunked"" rules is converted into LR table form, using the method of (Samuelsson, 1994a). "
"The experiment was carried out using both the chunking criteria from (Rayner and Samuelsson, 1994) (the ""Old"" scheme), and the chunking criteria described in Section 3 above (the ""New"" scheme). "
"Preliminary experiments we have carried out on the Swedish version of the CLE (Gambaick and Rayner 1992) have been encouraging; using exactly the same pruning methods and EBL chunking criteria as for English, we obtain comparable speed-ups. "
"We intend to do so soon, and also to repeat the experiments on the French version of the CLE (Rayner, Carter and Bouillon, 1996). "
"Our approach has been fully implemented in the program LExAs. Part of the implementation uses PEBLS (Cost and Salzberg, 1993; Rachlin and Salzberg, 1993), a public domain exemplar-based learning system. "
"This metric for measuring distance is adopted from (Cost and Salzberg, 1993), which in turn is adapted from the value difference metric of the earlier work of (Stanfill and Waltz, 1986). "
"One line of research focuses on the use of the knowledge contained in a machine-readable dictionary to perform WSD, such as (Wilks et al., 1990; Luk, 1995). In contrast, LEXAS uses supervised learning from tagged sentences, which is also the approach taken by most recent work on WSD, including (Bruce and Wiebe, 1994; Miller et al., 1994; Leacock et al., 1993; Yarowsky, 1994; Yarowsky, 1993; Yarowsky, 1992). "
"Most recently, Yarowsky used an unsupervised learning procedure to perform WSD (Yarowsky, 1995), although this is only tested on disambiguating words into binary, coarse sense distinction. The effectiveness of unsupervised learning on disambiguating words into the refined sense distinction of WoRBNET needs to be further investigated. "
"Our point of departure is the work of Lappin and Leass (1994, henceforth L&L) and Dagan et al. (1995). (See also Dagan and Itai (1990).  "
"Dagan et al. (1995) then developed a postprocessor based on predicate-argument statistics that was used to override RAP’s decision when it failed to express a clear preference between two or more antecedents, which resulted in a modest rise in performance (2.5%). "
"As previously indicated, the weight-based scheme of L&L suggests MaxEnt modeling (Berger et al., 1996) as a particularly natural choice for a machine learning approach. "
"We took two approaches to smoothing. First, because Dagan et al. used Good-Turing smoothing in their experiments, we did likewise so as to replicate their work as closely as possible. Second, we tried an approach based on the distributional clustering method of Pereira et al. (1993).  "
"We carried out an error analysis to gain further insight into this question. To address the data-sparsity issue, we employed the technique used in Keller and Lapata (2003, K&L) to get a more robust approximation of predicate-argument counts. "
"We describe a POS tag-ger based on the work described in (Padr6, 1996),that is able to use bi/trigram information, auto-matically learned context constraints and linguisti-cally motivated manually written constraints."
"The usual solutions to this problem are: l) Prune the tree. either during the construction process (Quinlan. 1993) or afterwards (Mingers, 1989); 2) Smooth the conditional probability distributions using fresh corpus a (Magerman, 1996). "
In a first step the tree is completely expanded and afterwards it is pruned following a minimal cost-complexity criterion (Breiman et al.. 1984). 
"Consider more complex context features, such as non-limited distance or barrier rules in the style of (Samuelsson et al., 1996). "
"This accuracy compares very favourably with results reported in (de Marcken, 1990; Weisehedel et al., 1993; Kempe, 1994) - for instance, to reach the recall of 99.3 %, the system by (Weischedel et al., 1993) has to leave as many as three readings per word in its output. "
"The tagger is reported (Cutting el al., 1992) to have a better than 96 % accuracy in the analysis of parts of the Brown Corpus. The accuracy is similar to other probabilistic taggers.  "
"Only in the analysis of a few words it was agreed that a multiple choice was appropriate because of different meaning-level interpretations of the utterance (these were actually headings where some of the grammatical information was omitted). Overall, these results agree with our previous experiences (Karlsson et al., 1994) "
"We could leave the text partly disambiguated, and use a syntactic parser that uses both lin-guistic knowledge and corpus-based heuristics (see (Tapanainen and J//rvinen, 1994)) "
"Turney (2008) recently advocated the need for a uniform approach to corpus-based semantic tasks. Turney recasts a number of semantic challenges in terms of relational or analogical similarity. Thus, if an algorithm is able to tackle the latter, it can also be used to address the former. Turney tests his system in a variety of tasks, obtaining good results across the board. "
Our approach to selectional preference is nearly identical to the one of Padó et al. (2007). We solve SAT analogies with a simplified version of the method of Turney (2006). 
"Finally, our method to detect verb slot similarity is analogous to the “slot overlap” of Joanis et al. (2008) and others. "
"We use the dataset of Rubenstein and Good enough (1965), consisting of 65 noun pairs rated by 51 subjects on a 0-4 similarity scale (e.g. car- automobile 3.9, cord-smile 0.0). "
