"We generate all the morphologically related forms of the word pair using a lexical transducer for English ( Karttunen et al., 1992)."
"The Xerox tagger is claimed (Cutting el al., 1992) to be adaptable and easily trained; only a lexicon and suitable amount of untagged text is required.  "
"Our constraint-based tagger is based on techniques that were originally developed for morphological analysis. The disambiguation rules are similar to phonological rewrite rules (Kaplan and Kay, 1994), and the parsing algorithm is similar to the algorithm for combining the morphological rules with the lexicon (Karttunen, 1994). "
"We also tried combining the tuggers, using first the rules and then the statistics (a similar approach was also used in (Tapanainen and Vouti- Lainen, 1994)). "
"Kupiec (1992) has proposed an estimation method for the N-gram language model using the Baum-Welch reestimation algorithm (Rabiner et al., 1994) from an untagged corpus and Cutting et al. (1992) have applied this method to an English tagging system.Takeuchi and Matsumoto (1995) also have developed an extended method for unsegmented languages (e.g., Japanese) and applied it to their Japanese tagger.  "
"Juman (Matsumoto et al., 1994) was used in our experiments to generate the morpheme network. Juman is a rule-based Japanese tagging system which uses hand-coding cost values that represent the implausibility of morpheme connections, and word- and tag-occurences. "
"The credit factor improved the upper bound of the estimation accuracy from an untagged corpus. However, at higher levels of tagging accuracy, the reestimation m e t h o d based on the Baum-Welch algorithm is limited by the noise of untagged corpora. On this point, I agree with Merialdo (1994) and Elworthy (1994). "
"In the bigram model, we can weight each probability of a pair of tags in both models estimated from tagged or untagged corpora. A smoothing method, such as deleted interpolation (Jelinek, 1985), can be used for Weighting."
"A very influential is the work of Brill (1997), who induces more linguistically motivated rules exploiting both a tagged corpus and a lexicon. He does not look at the affixes only, but also checks their POS class in a lexicon. Mikheev (1997) proposes a similar approach, but learns the rules from raw as opposed to tagged text. Daciuk (1999) speeds up the process by means of finite state transducers. "
"In particular, in our experiments we used the Large Grammatical Dictionary of Bulgarian (Paskaleva,2003), created at the Linguistic Modelling Department of the Bulgarian Academy of Sciences (CLPP-BAS) and comprising approximately 995,000 wordforms (about 65,000 lemmas), encoded in DELAF format (Silberztein,1993). "
"Our approximate rules are similar to the ones proposed by Mikheev (1997), who uses a dictionary to build POS prediction rules with four parts "
"Next, it looks promising to try to estimate the dictionary word frequencies using a search engine instead of text corpus, as proposed by Lapata and Keller (2004) "
"Finally, we would like to explore the machine learning potential offered by morphological dictionaries with application to other related tasks such as stemming (Nakov, 2003), lemmatisation and POS tagging "
"Och (2003) provides evidence that Λ should be chosen by optimizing an objective function based on the evaluation metric of interest, rather than likelihood. Since the error surface is not smooth, and a grid search is too expensive, Och suggests an alternative, efficient, line optimization approach. "
"In spite of these advantages, recent work has pointed out a number of problematic aspects of BLEU that should cause one to pause and reconsider the reliance on it. Chiang et al. (2008) investigate several weaknesses in BLEU and show there are realistic scenraios where the BLEU score should not be trusted, and in fact behaves in a counter-intuitive manner. Furthermore, Callison Burch et al. (2006) point out that it is not always appropriate to use B LEU to compare systems to each other. "
"We use Joshua (Li et al., 2009), in our experiments. Joshua is a hierarchical parsing-based MT system, and it can be instructed to produce derivation trees instead of the candidate sentence string Itself. "
"The MT system we used is Joshua (Li et al., 2009), a software package that comes complete with a grammar extraction module and a MERT module, in addition to the decoder itself. "
"On the other hand, Snow et al. (2008) illustrate how AMT can be used to collect data in a “fast and cheap” fashion, for a number of NLP tasks, such as word sense disambiguation. They go a step further and model the behavior of their annotators to reduce annotator bias. "
The formaliza-tion of this notion and an algorithm for computing the composed transducer are wellknown and are described originally by Elgot and Mezei (1965).
"We empirically compared our tagger with Eric Brill's implementation of his tagger,and with our implementation of a trigram tagger adapted from the work of Church(1988) that we previously implemented for another purpose."
"Independently, Cutting et aL (1992) quote a performance of 800 words per secondfor their part-of-speech tagger based on h i d d e n Markov models."
This compression is achievedwhile maintaining random access using a procedure for sparse data tables followingthe method given by Tarjan and Yao (1979).
"No pretagged text is necessary for Hidden Markov Models (Jelinek, 1985; Cutting et al., 1991; Kupiec, 1992). "
Brill and Marcus (1992a) have shown that the effort necessary to construct the part-of-speech lexicon can be considerably re- duced by combining learning procedures and a partial part-of-speech categorization elicited from an informant. 
"We obtained 47,025 50-dimensional reduced vectors from the SVD and clustered them into 200 classes using the fast clustering algorithm Buckshot (Cutting et al., 1992)"
"There is both synchronic (Ross, 1972) and diachronic (Tabor, 1994) evidence suggesting that words and their uses can inherit properties from several prototypical syntactic categories. "
"We use the English Slot Grammar(ESG) parser developed at IBM (McCord, 1990) to analyze the syntactic structure of an input sentence and produce a sentence parse tree. The ESG parser not only annotates the syntactic category of a phrase, it also annotates the thematic role of a phrase . "
The same asymptotic complexityis of course found for memory storage in this approach. We use IGTrees (Daelemans etal. 1996) to compress the memory. IGTree is a heuristic approximation of the IB-IGAlgorithm.
"The recursive algorithms for tree construction (except the final pruning) and retrieval are given in Figures 1 and 2. For a detailed discussion, see  aelemans et al. (1996). "
"A windowing approach (Sejnowski & Rosenberg, 1987) was used to represent the tagging task as a classification problem. "
"Again, we take advantage of the data fusion capabilities of a memory-based approach by combining these two sources of information in the case representation, and having the information gain feature relevance weighting technique figure out their relative relevance (see Schmid, 1994; Samuelsson, 1994 for similar solutions) "
"The experimental methodology was taken from Machine Learning practice (e.g. Weiss & Kulikowski, 1991): independent training and test sets were selected from the original corpus, the system was trained on the training set, and the generalization accuracy (percentage of correct category assignments) was computed on the independent test set. "
"The above problems could be partially solved by introducing more resources into collocation extraction, such as chunker (Wermter and Hahn, 2004), parser (Lin, 1998; Seretan and We hrli, 2006) and WordNet (Pearce, 2001)."
"We adapt the bilingual word alignment model, IBM Model 3 (Brown et al., 1993), to monolingual word alignment. "
"We take BBN’s HierDec, a string-to-dependency decoder as described in (Shen et al., 2008), as our baseline for the following two reasons "
"Marton and Resnik (2008) introduced features defined on constituent labels to improve the Hier-o system (Chiang, 2005). However, due to the limitation of MER training, only part of the feature space could used in the system. This problem was fixed by Chiang et al. (2008), which used an online learning method (Crammer and Singer, 2003) to handle a large set of features. "
"Most SMT systems assume that translation rules can be applied without paying attention to the sentence context. A few studies (Carpuat and Wu, 2007; Ittycheriah and Roukos, 2007; He et al., 2008; Hasan et al., 2008) addressed this defect by selecting the appropriate translation rules for an input span based on its context in the input sentence."
"The direct translation model in (Ittycheriah and Roukos, 2007) employed syntactic (POS tags) and context information (neighboring words) within a maximum entropy model to predict the correct transfer rules. A similar technique was applied by He et al. (2008) to improve the Hiero system."
"Automatic analysis of natural language is still a very hard task to perform for a computer. Although some successful applications have been developed (see for instance (Chinchor, 1998)), implementing an automatic text analysis system is still a labour and time intensive task. "
"Gildea and Jurafsky (2002) were the first to describe a statistical system trained on the data from the FrameNet project to automatically assign semantic roles. This approach was soon followed by other researchers (Surdeanu et al., 2003; Pradhan et al., 2004; Xue and Palmer, 2004), focusing on improved sets of features, improved machine learning methods or both, and SRL became a shared task at the CoNLL 2004, 2005 and 2008 Conferences"
"The best system (Johansson and Nugues, 2008) in CoNLL 2008 achieved an F1-measure of 81.65% on the workshop’s evaluation Corpus."
"To the best of our knowledge no system was able to reproduce the successful results of (Swier and Stevenson, 2004) on the PropBank Roleset. "
Our approach most closely resembles the work of Fürstenau and Lapata (2009) who automatically expand a small training set using an automatic dependency alignment of unlabeled sentences.
"Fillmore (1968) introduced semantic structures called semantic frames, describing abstract actions or common situations (frames) with common roles and themes (semantic roles). Inspired by this idea different resources were constructed, including FrameNet (Baker et al., 1998) and PropBank (Palmer et al., 2005)."
"An alternative approach to semantic role labeling is the framework developed by Halliday (1994) and implemented by Mehay et al. (2005). PropBank has thus far received the most attention of the research community, and is used in our work "
"To estimate the parameters of the MEMM+predmodel we turn to the successful Maximum Entropy (Berger et al., 1996) parameter estimation Method."
"The Distributional Hypothesis, supported by theoretical linguists such as Harris (1954), states that words that occur in the same contexts tend to have similar meanings. This suggests that one can learn the similarity between two words automatically by comparing their relative contexts in a large unlabeled corpus, which was confirmed by different researchers (e.g. (Lin, 1998; McDonald and Ramscar, 2001; Grefenstette, 1994)). "
"We employ a slightly different clustering method here, the fullibmpredict method discussed in (Goodman, 2001). This method was shown to outperform the class based model proposed in (Brown et al., 1992) and can thus be expected to discover better clusters of words. "
"Statistical systems have enjoyed considerable success for information retrieval, especially using the vector space model (Salton et al., 1975)."
"Our summarization system relies on semantic predications provided by SemRep (Rindflesch and Fiszman, 2003), a program that draws on UMLS information to provide underspecified semantic interpretation in the biomedical domain (Srinivasan and Rindflesch, 2002; Rindflesch et al., 2000). "
"However, due to the challenges in providing semantic representation, semantic abstraction has not been widely pursued, although the TOPIC system (Hahn and Reimer, 1999) is a notable exception. "
"Phase 4 (saliency) is the final transforma tion phase and its operations are adapted from TOPIC’s (Hahn and Reimer, 1999) saliency operators. "
"Sub-events (Daniel et al., 2003) and sub-topics (Saggion and Lapalme, 2002) also contribute to the framework used for comparing documents in multidocument summarization. "
"For example, both Haghighi and Klein (2006) and Mann and McCallum (2008) have demonstrated results better than 66.1% on the apartments task described above using only a list of 33 highly discriminative features and the labels they indicate. "
"In traditional active learning (Settles, 2009), the machine queries the user for only the labels of instances that would be most helpful to the machine. "
"In this paper, we advocate using generalized expectation (GE) criteria (Mann and McCallum, 2008) for learning with labeled features. We provide an alternate treatment of the GE objective function used by Mann and McCallum (2008) and a novel speedup to the gradient computation. "
"Computing the first term of the covariance in Equation 2 requires a marginal distribution over three labels, two of which will be consecutive, but the other of which could appear anywhere in the sequence. We can compute this marginal using the algorithm of Mann and McCallum (2008). "
"Motivated by the feature query selection method of Tandem Learning (Raghavan and Allan, 2007) (see Section 4.2 for further discussion), we consider a feature selection metric similarity (sim) that is the maximum similarity to a labeled feature, weighted by the log count of the feature. "
"Liang et al. (2009) simultaneously developed a method for learning with and actively selecting measurements, or target expectations with associated noise. The measurement selection method proposed by Liang et al. (2009) is based on Bayesian experimental design and is similar to the expected information gain method described above. Consequently this method is likely to be intractable for real applications. "
"Chang et al. (2007) only obtain better results than 88.2% on cora when using 300 labeled examples (two hours of estimated annotation time), 5000 additional unlabeled examples, and extra test time inference constraints. "
"Concurrent work has used approximate counting schemes based on Morris (1978) to estimate in small space frequencies over a high volume input text stream (Van Durme and Lall, 2009; Goyal et al., 2009)."
Randomised algorithms are not the only compact representation schemes. Church et al. (2007) looked at Golomb Coding and Brants et al. (2007) used tries in a distributed setting. These methods are less succinct than randomised approaches. 
"Much progress in the area of semantic role labeling is due to the creation of resources like FrameNet (Fillmore et al., 2003), which document the surface realization of semantic roles in real world corpora. "
"Specifically, we view the task of inferring annotations for new verbs as an instance of a structural matching problem and follow a graph-based formulation for pairwise global network alignment (Klau, 2009). "
"Previous work has mainly used WordNet (Fellbaum, 1998) to extend FrameNet. For example, Burchardt et al. (2005) apply a word sense disambiguation system to annotate predicates with a WordNet sense and hyponyms of these predicates are then assumed to evoke the same frame. Johansson and Nugues (2007) treat this problem as an instance of supervised classification. "
In this paper we generalize the proposals of Pennacchiotti et al. (2008) and Fürstenau and Lapata (2009) in a unified framework. We create training data for semantic role labeling of unknown predicates by projection of annotations from labeled onto unlabeled data. 
"FrameNet provides definitions for more than 500 frames, of which we entertain only a small number. This is done using a method similar to Pennacchiotti et al. (2008). "
"We solve this optimization problem with a version of the branch-and-bound algorithm (Land and Doig, 1960). In general, this graph alignment problem is NP-hard (Klau, 2009) and usually solved approximately following a procedure similar to beam search. "
Our evaluation assessed the performance of a semantic frame and role labeler with and without the annotations produced by our method. The labeler followed closely the implementation described in Johansson and Nugues (2008). 
"We extracted features from dependency parses corresponding to those routinely used in the semantic role labeling literature (see Baker et al. (2007) for an overview). SVM classifiers were trained 2 with the L IB L INEAR library (Fan et al., 2008) and learned to predict the frame name, role spans, and role labels. "
"The algorithm is again described by Cutting et al. and by Sharman, and a mathematical justification for it can be tbund in Huang et al. (1990). "
"The first major use of HMMs for part of speech tagging was in CLAWS (Garside et al., 1987) in the 1970s. "
"One of the most effective taggers based on a pure HMM is that developed at Xerox (Cutting et al., 1992). An important aspect of this tagger is that it will give good accuracy with a minimal amount of manually tagged training data. "
"For example, CLAWS (Garside ct al., 1987) normalises the lexical probabilities by the total frequency of the word rather than of the tag. Consulting the Baum- Welch re-estimation formulae suggests that the approach described is more appropriate, and this is confirmed by slightly greater tagging accuracy. "
"In (Riley, 1989), Riley describes a decision-tree based approach to the problem. His performance on /he Brown corpus is 99.8%, using a model learned t'rom a corpus of 25 million words. "
"There has now been considerable work on discourse parsing using statistical bottom-up parsing (Soricut and Marcu, 2003), hierarchical agglomerative clustering (Sporleder and Lascarides, 2004), parsing from lexicalized tree-adjoining grammars (Cristea, 2000), and rule-based approaches that use rhetorical relations and discourse cues (Forbes et al., 2003; Polanyi et al., 2004; LeThanh et al., 2004). With the exception of Cristea (2000), most of this research has been limited to non-incremental parsing of textual monologues where, in contrast to incremental dialog parsing, predicting a system action is not relevant."
"In addition to the hand-crafted models listed above, researchers have built stochastic plan recognition models for interaction, including ones based on Hidden Markov Models (Bui, 2003; Blaylock and Allen, 2006) and on probabilistic context-free grammars (Alexandersson and Reithinger, 1997; Pynadath and Wellman, 2000). "
"This encoding was previously used for incremental sentence parsing by (Costa et al., 2001). With this method, there are many more choices of decision for the parser (195 decisions for our data) compared to the shift-reduce (32) and start-complete (82) methods. "
"We use the machine learning toolkit LLAMA (Haffner, 2006), which encodes multiclass classication problems using binary MaxEnt classifiers to increase the speed of training and to scale the method to large data sets. "
"We note that these results are competitive with those reported in the literature (e.g. (Poesio and Mikheev, 1998; Serafin and Eugenio, 2004)), although the dialog corpus and the label sets are different. "
"The expectation semiring (Eisner, 2002), originally proposed for finite-state machines, is one such “training” semiring, and can be used to compute feature expectations for the Estep of the EM algorithm, or gradients of the like-lihood function for gradient descent.  "
"We implement the expectation and variance semirings in Joshua (Li et al., 2009a), and demonstrate their practical benefit by using minimum-risk training to improve Hiero (Chiang, 2007). "
"A much more efficient approach (usually) is the traditional inside-outside algorithm (Baker, 1979). "
"If entropy H(p) is large (e.g., small γ), the Bayes risk Thus, Smith and Eisner (2006) try to avoid local minima by starting with large H(p) and decreasing it gradually during optimization. This is called deterministic annealing (Rose, 1998). "
"We used a 5-gram language model with modified Kneser-Ney smoothing, trained on the bitext’s English using SRILM (Stolcke, 2002). "
"MR (with or without DA) is scalable to tune a large number of features, while MERT is not. To achieve competitive performance, we adopt a forest reranking approach (Li and Khudanpur, 2009; Huang, 2008)."
"Clearly, adding more features improves (statistically significant) the case with only five features. We plan to incorporate more informative features described by Chiang et al. (2009). "
"Our approach is theoretically elegant, like other work in this vein (Goodman, 1999; Lopez, 2009; Gimpel and Smith, 2009). We used it practically to enable a new form of minimum-risk training that improved Chinese-English MT by 1.0 BLEU point. "
"Research on Statistical Machine Translation (SMT) has shown substantial progress in recent years. Since the success of phrase-based methods (Och and Ney, 2004; Koehn, 2004), models based on formal syntax (Chiang, 2005) or linguistic syntax (Liu et al., 2006; Marcu et al., 2006) have also achieved state-of-the-art performance."
"The second aspect motivating our work comes from the subspace learning method in machine learning literature (Ho, 1998), in which an ensemble of classifiers are trained on subspaces of the full feature space, and final classification results are based on the vote of all classifiers in the Ensemble. "
Nowadays most of the state-of-the-art SMT systems are based on linear models as proposed in Och and Ney (2002). 
"Since we also adopt a linear scoring function in Equation (3), the feature weights of our combination model can also be tuned on a development a set to optimize the specified evaluation metrics using the standard Minimum Error Rate Training (MERT) algorithm (Och 2003). "
"Our method is similar to the work proposed by Hildebrand and Vogel (2008). However, except the language model and translation length, we only use intra-hypothesis n-gram agreement features as Hildebrand and Vogel did and use additional intra-hypothesis n-gram disagreement feature  as Li et al. (2009) did in their co-decoding Method. "
Statistical significance is computed using the bootstrap re-sampling method proposed by Koehn (2004).  
"A number of part-of-speech taggers are readilyavailable and widely used, all trained and retrainable on text corpora (Church 1988;Cutting et al. 1992; Brill 1992; Weischedel et al. 1993)."
"Endemic structural ambiguity,which can lead to such difficulties as trying to cope with the many thousands of possi-ble parses that a grammar can assign to a sentence, can be greatly reduced by addingempirically derived probabilities to grammar rules (Fujisaki et al. 1989; Sharman, Je-linek, and Mercer 1990; Black et al. 1993) and by computing statistical measures oflexical association (Hindle and Rooth 1993)."
Aneffort has recently been undertaken to create automated machine translation systemsin which the linguistic information needed for translation is extracted automaticallyfrom aligned corpora (Brown et al. 1990).
"There are a number of efforts worldwide to manually annotate largecorpora with linguistic information, including parts of speech, phrase structure andpredicate-argument structure (e.g., the Penn Treebank and the British National Corpus(Marcus, Santorini, and Marcinkiewicz 1993; Leech, Garside, and Bryant 1994))."
"Useful tools, such as large aligned corpora (e.g., the aligned Hansards (Galeand Church 1991)) and semantic word hierarchies (e.g., Wordnet (Miller 1990)), havealso recently become available."
"Part-of-speech tagging is an activearea of research; a great deal of work has been done in this area over the past few years(e.g., Jelinek 1985; Church 1988; Derose 1988; Hindle 1989; DeMarcken 1990; Merialdo1994; Brill 1992; Black et al. 1992; Cutting et al. 1992; Kupiec 1992; Charniak et al. 1993;Weischedel et al. 1993; Schutze and Singer 1994)."
"Also, it ispossible to cast a number of other useful problems as part-of-speech tagging problems,such as letter-to-sound translation (Huang, Son-Bell, and Baggett 1994) and buildingpronunciation networks for speech recognition. Recently, a method has been proposedfor using part-of-speech tagging techniques as a method for parsing with lexicalizedgrammars (Joshi and Srinivas 1994)."
Roche and Schabes (1995) show a method for converting a listof tagging transformations into a deterministic finite state transducer with one statetransition taken per word of input; the result is a transformation-based tagger whosetagging speed is about ten times that of the fastest Markov-model tagger.
"In this respect, the present work is closer in spirit to Ji et al. (2005), who explore the employment of the ACE 2004 relation ontology as a semanticfilter. "
"For learning coreference decisions, we used a Maximum Entropy (Berger et al., 1996) model. "
"First, a set of pre-processing components including a chunker and a named entity recognizer is applied to the text in order to identify the noun phrases, which are further taken as REs to be used for instance generation. Instances are created following Soon et al. (2001)."
"Following Ng & Cardie (2002), our baseline system reimplements the Soon et al. (2001) system. "
"Systems were optimized on the WMT08 French- nglish development data (2000 sentences) using minimum error rate training (Och, 2003) and tested on the WMT08 test data (2000 sentences). "
All other settings were left at their default values as described by Chiang (2007) and Koehn et al. (2007).
