"When HTC introduced the Windows-based smartphone, it recruited 1000 T-Mobile or AT&T customers to write product reviews and Facebook and Twitter posts, reaching more than 234,000 consumers and significantly increasing the brand awareness [12]. When Dunkin’ Donuts launched Latte Lite, it used 3000 consumers to spread the word about the new beverage, reaching 111,272 consumers over twelve weeks and increasing sales by 26% in test markets [13]. Both examples illustrate that electronic or online word of mouth (eWOM) has become an important factor in consumer buying decisions [37]. "
"Consumers trust eWOM more than advertisements, as they regard their peers as more reliable than companies [65]. "
"Although eWOM is implemented by consumers, companies can initiate eWOM campaigns for marketing communications [35]. "
"To launch an effective eWOM campaign, companies need to identify a small number of disseminators known as opinion leaders who exert personal influence upon other people [68]. "
"Identification of opinion leaders relies on the “two-step flow of communications” theory: as senders, opinion leaders cultivate their knowledge from a variety of sources including mass media in the first step, and then spread their opinions (messages) to the general public (receivers) via WOM in the second step [47]. Thus, sender, message, and receiver are key components in the WOM process [6,20], and provide three important bases for searching for opinion leaders."
"However, a survey may capture self-confidence rather than opinion leadership for two reasons [61,68]."
"Opinion leader WOM has long been used to promote products or to criticize competitors’ offerings [44,47]; its positive impact on new product introduction was first reported by Arndt [3]. "
"One of the most important capabilities of the Internet is interactive communication at a larger scale: “for the first time in human history, individuals can make their personal thoughts, reactions, and opinions easily accessible to the global community of Internet users”, and the interactive communication provides an online feedback mechanism to serve multiple functions, including brand building and customer acquisition, product development and quality control, and supply chain quality assurance [26]."
Electronic commerce performs better than the traditional market in acquiring customers [77]. 
"To be effective in viral marketing campaigns, companies must identify opinion leaders properly and then let them communicate information to their followers [43]."
Opinion leaders are consumers who provide information to others that influences their consumption decisions [22] by obtaining key information through research and shaping their own opinions earlier than the general public.
"Opinion leaders in women’s fashion, for example, acquire fashion knowledge from fashion magazines first and then spread it to followers via WOM [70]."
Rogers and Cartano [68] noted that sender-based surveys are “dependent upon the accuracy with which respondents [senders] can assess and report their self-images on opinion leadership”.
"The network structure method has been widely used by marketers and network analysis researchers [41,43]. Network analysis determines opinion leaders by identifying those who connect with many people (i.e., hubs) and those who connect two clusters of densely connected people (i.e., bridges) in a social network [41]. "
"Since the advent of the Internet in the 1990s, WOM is no longer restricted to personal influence networks because the Internet allows one to reach strangers at a larger scale [26]."
Godes & Mayzlin [35] adopted the King and Summers scale to measure how many followers an opinion leader reaches.
"Buzz is generated around a product when a large number of followers receive eWOM [11,31]. Previous studies suggest that opinion leaders are progressive attention-seekers [70] and fulfill their self-enhancement motivation via buzz creation [33]. "
"Trust is an important issue in electronic commerce and eWOM studies (e.g., [26,80]), as it is one of the main reasons for followers to seek advice from opinion leaders."
"An indirect approach to measure trustworthiness is analyzing the structural, lexical, and semantic aspects of eWOM, which are found to be associated with trustworthiness [10]. "
"The amount of eWOM influences consumers in two ways: eWOM increases exposure to a product and therefore increases consumer awareness of its existence [54]; and a large amount of eWOM suggests a product’s popularity [17,79]. Previous studies reveal that the amount of eWOM created by the general public drives sales [21,27,29,54]."
"Consumers communicate their satisfaction using online user ratings [18,71]. Positive ratings created by the general public can improve consumer attitude, while negative ratings created by the general public can worsen consumer attitude [54]. Customer satisfaction among the general public has been found to have a positive impact on future sales [4,78]."
"They are also motivated to contribute their knowledge to other consumers [19,39]."
" According to Childers [22], opinion leadership is product category specific. The more a consumer purchases and consumes within the same product category, the more likely the consumer is to acquire complex category knowledge. "
"Our dataset contains a sample of 350,122 book, music, video and DVD titles, which, as experience goods, have qualities difficult to ascertain before consumption, making user reviews helpful for consumers [60,63]. "
The overlap between different types of opinion leaders is consistent with extant literature [43].
"Previous research suggests that an opinion leader needs to have both knowledge and influence [47,57]. Since opinion leaders have different breadths of product category knowledge, it is important to examine which kinds of opinion leaders can be more effective in driving sales [34]. Knowledge and influence, the two components of opinion leadership, are not independent. "
"Katz and Lazarsfeld [47] argue that personal influence does not flow from highly interested individuals to less interested individuals, but rather between those with shared interests. Therefore, if general knowledge implies general interest, an opinion leader with broad product category knowledge will attract more followers [58]."
"Fashion industry companies use celebrities such as Madonna as opinion leaders [76], while the pharmaceutical industry uses physicians on editorial boards/scientific committees and with prestigious academic appointments [32,38,49]. When consumers are not celebrities or experts, practitioners use sender-based and receiver-based methods."
"For example, the eWOM company BzzAgent measures engagement as the number of likes, comments, and retweets a consumer’s post receives [9]. The opinion leaders identified through this process are similar to the buzz-generating opinion leaders in our paper."
"We recommend that companies implement online user review systems using Amazon’s patented design [8], and identify the top 1% of communicative, buzz-generating, and trustworthy eWOM opinion leaders among users by measuring eWOM volume, feedback received, and helpful votes received. "
This article presents a new opinion leader identification method rooted in the interpersonal communication theory that inspired sender- and receiver-based methods [47]. 
"By demonstrating how to identify opinion leaders from a large number of consumers, this article shows that companies can collect useful business intelligence from increasingly large amounts of data available to them—a central theme emerging in big data analytics [16]."
"Wireless Mesh Sensor Networks (WMSNs) comprise a technological field that has arisen as the natural evolution from the conventional Wireless Sensor Networks (WSNs), composed of only a few nodes, to large-scale networks in which sources and destinations are interconnected through different paths of intermediate nodes forming a mesh layoutÂ  [1]."
"To this end, new mesh capabilities such as multi-hop mesh routing, scalability, robustness, reliability, self-organization or energy efficiency must be satisfiedÂ  [2]. "
" To achieve this purpose, ASES integrates, in a single solution, an efficient duty-cycle strategy for saving energy along with most of the above mesh capabilities. This fact makes IEEE 802.15.5 standard and its ASES mechanism advantageous with respect to other WMSN approachesÂ  [2], such as Zigbee ProÂ  [3], the International Engineering Task Force (IETF) with its solution IPv6 over Low power Wireless Personal Area Networks (6LoWPAN)Â  [4], WirelessHARTÂ  [5] or ISA SP100.11aÂ  [6]."
" Second, physical-space constraints (e.g.,Â obstacles such as walls, and pillars)Â  [38,39] impose strict restrictions in the application management, such as the impossibility of using relay/sink mobility to improve the network performance. Similarly, Assumption (ii) copes with the premises of data monitoring in the aforementioned domain-driven applications, where physical sensing information is collected and reported periodically. "
"Despite these known problems related to large-scale agile, there is an industry trend towards adopting agile methodologies in-the-large ( VersionOne,Inc, 2016; Paasivaara et al., 2013, 2014; Dings yr and Moe, 2014)."
"According to the latest survey ( VersionOne, Inc, 2016), 62% of the almost 4000 respondents had more than a hundred people in their software organization and 43% of all the respondents worked in development organizations where more than half of the teams were agile"
"However, this indicates that there seems to exist a large number of companies that have taken or are taking agile into use in large-scale settings ( VersionOne, Inc,2016)."
"In two recent workshops on large-scale agile development organized in XP2013 and XP2014 conferences, adoption of agile methods was one of the highlighted themes needing more research ( Dings yr and Moe,2013,2014)."
"Traditional methods focus on up-front planning and strict management of change, but agile methods were designed to accept and efficiently manage change ( Highsmith and Cockburn, 2001; Cockburn and Highsmith, 2001)."
"Agile methods have been both criticized and advocated, and research has shown that accommodating change may be a factor in both success and failure ( Boehm, 2002)"
"It has been shown that agile methods have improved satisfaction of both customers and developers, but on the other hand there is evidence that agile methods may not be a good fit for large undertakings ( Dyb  and Dings yr, 2009)"
"For example, one paper would highlight the viewpoint of the developers ( Fry and Greene, 2007), and another would consider the transformation from the user experience designers point of view ( Federoff and Courage, 2009)."
"Surveys on challenges and success factors for agile projects in general have been conducted, eg( Chow and Cao, 2008)"
" The traditional methods for estimating PDFs, e.g. binning methods and kernel density techniques, require specification of a bandwidth parameter that heavily influences the shape of the resulting PDF (Silverman, 1986; Wilks, 2006; Srihera and Stute, 2011). "
"While methods exist for estimating an optimal bandwidth, these methods usually require some assumption about the shape of the underlying PDF (Wand and Jones, 1995; Srihera and Stute, 2011; Bernacchia and Pigolotti, 2011). Given that our application requires an unbiased determination of the normality of the velocity increments, estimation methods utilizing such assumptions would not be suitable for our analysis. "
"Kernel density estimation is a widely used method for estimating the probability distribution function (PDF) of a given dataset (e.g., Silverman, 1986, Wilks, 2006), in which the PDF is approximated as a normalized sum of kernel functions K(Ï) centered on each data point Ïj"
"The convolution part of this algorithm requires íª(Nâq) calculations and the FFT portion requires íª(MâlogM) (Cooley and Tukey, 1965). Simple algebraic manipulation can show that if q<M and logMâªN, then Nâq+MâlogM<NâM, and so the nuFFT is theoretically faster than the direct DFT calculation"
"We also note that we implemented the selective frequency filter, In, in a slightly different manner than Bernacchia and Pigolotti (2011). They show that the self-consistent density estimate converges on the true density provided the filter In is set to 1 for some subset of the frequencies for which C is above the estimate stability threshold given by |Cn|2â¥4â(Nâ1)âNâ2 and set to 0 for all other frequencies. Whereas they choose the subset based on a frequency cut-off tâ such that C is above the stability threshold for half of the frequencies within [âtâ,tâ], we choose a cut-off frequency based on the occurrence of three consecutive C values below the stability threshold. In our implementation In=0 for all n>nâ, where nâ is the index of the lowest frequency for which Cnâ+1,Cnâ+2, and Cnâ+3 are below the stability threshold. We choose this criterion because it is fast to implement and we find that it avoids an occasional, spurious leakage of high-frequency components that manifests as high-frequency waves superimposed on the density estimate."
" We use a version of CAM4 that includes the Model for Prediction Across Scales atmospheric (MPAS-A) dynamical core, which predicts the evolution of the atmosphere by evaluating conservation laws (e.g., conservation of mass, momentum, etc.) on a centroidal Voronoi tessellation of the sphere (Rauscher etÂ al., 2013; Skamarock etÂ al., 2012)."
"As every software artifact, also software models ( B zivin,2005) are subject to continuous evolution"
"Knowing the operations applied between two successive versions of a model is not only crucial for helping developers to efficiently understand the model's evolution ( Koegel et al., 2010), but it is also a major prerequisite for model management tasks, such as model co-evolution ( Herrmannsdoerfer et al., 2009; Mens,2008) and model versioning ( Brosch et al., 2010; Koegel et al., 2010)"
"The second category comprises composite operations ( Suny et al.,2001) consisting of a set of cohesive atomic operations, which are applied within one transaction to achieve one common goal"
The most prominent class of such composite operations are refactorings introduced by Opdyke (1992)
"As reported in Herrmannsdoerfer et al.(2009), Mens (2008), Brosch et al. (2010) and Koegel et al.(2010), the detection of applied refactorings is a crucial prerequisite for automating model management tasks"
"However, composite operations are not limited to refactorings; they may be used to implement any kind of in-place model transformation for a specific purpose, such as model completion ( Sen et al.,2010), refinement ( Ruhroth and Wehrheim, 2012), and evolution ( Meyers and Vangheluwe, 2011)."
"One way to acquire the set of applied composite operations is to use operation recording ( Herrmannsdoerfer and K gel, 2010; Lippe and Oosterom, 1992); that is, the execution of operations is tracked within the modeling environment while they are performed"
"A set of manually applied atomic operations, having together the intent of a composite operation, which is indeed frequently happening in practice ( Murphy-Hill et al.,2009), cannot be identified, because no explicit command has been issued in the modeling environment"
"In the absence of an operation log, the applied operations have to be detected a posteriori using state-based model comparison approaches using either generic model comparison algorithms ( Brun and Pierantonio, 2008; Kelter et al., 2005; Lin et al., 2007; Schmidt and Gloetzner, 2008) or language-specific comparison algorithms ( Kolovos, 2009; Xing and Stroulia, 2005)"
"In an endeavor to establish a commonly accepted conceptual framework for the rapidly growing number of domain-specific modeling environments, the Object Management Group (OMG) released the specification for Model Driven Architecture (MDA) ( Object Management Group, 2005), standardizing the definition and usage of (meta-)metamodels resulting in a metamodeling stack as depicted in Fig1"
Hartung et al.(2010) present an approach for generating so called semantically enriched evolution mappings between two versions of an ontology
"For limiting the search space of combinable composite operations, we may use the critical pair analysis comparable to how it has been done in Mens (2006)."
"Modern trends in manufacturing are defined by mass customization, small lot sizes, high variability of product types, and a changing product portfolio during the lifecycle of an automated production system (aPS) (Lüder et al., 2005; Rzevski, 2003). These trends imply more complex aPS (Mcfarlane and Bussmann, 2000), which support changes in the physical layout of the aPS including extensive technical updates."
"Since the proportion of system functionality that is realized by software is increasing (Thramboulidis, 2010), concepts for supporting automation engineers in handling this complexity are strongly required. "
"Software as well as software engineering in this domain need to fulfill specific requirements, e.g. regarding real-time and reliability (Vogel-Heuser et al., 2014a, 2014b, 2014c). "
"aPS are comprised of mechanical parts, electrical and electronic parts (automation hardware) and software, all closely interwoven, and thus represent a special class of mechatronic systems (Bonfè and Fantuzzi, 2003; Rzevski, 2003) and consist of mechatronic sub-systems like sensors and actuators."
 Lehman (1980) defined laws of software evolution and – among others – identified that systems are subject to dynamics causing continuing changes of software resulting into increasing complexity.
" Lehman (1980) defined laws of software evolution and – among others – identified that systems are subject to dynamics causing continuing changes of software resulting into increasing complexity. Evolution might be triggered in each phase of an aPS's life. Hence, due to their evolution and the long-living character of aPs, their life is characterized as a cycle (Birkhofer et al., 2010). "
" Software maintainability is “the ease with which a software system can be modified to correct faults, improve performance or other attributes or adapt to change environments” (IEC, 1990)."
"Accordingly, maintenance can either involve repair or modification actions, which in turn can be adjustments to the environment (referred to as adaptive maintenance) or augmentation of a system's function (Avizienis et al., 2004). "
"In the context of maintainability, obsolescence management, i.e., managing, mitigating and resolving the impact of (sub-)component obsolescence, is one important issue regarding long-living systems (ISO/IEC 25010, 2011)."
 An approach to explicitly modeling changes of aPS' physical structures and for analyzing their effects on the system's functions is proposed in Göring and Fay (2013) alongwith the physical causes of these changes.
"According to Wiendahl et al. (2007), changeability “is defined as characteristics to accomplish early and foresighted adjustments of the factory's structure and processes”. In contrast, reconfigurability is defined as the “ability of a manufacturing or assembly system to switch with minimal effort and delay to a particular family of workpieces or subassemblies through the addition or removal of functional elements” (Wiendahl et al., 2007)."
"Drivers for evolution are manifold (Westkämper, 2003), and basically result in changes of requirements on the aPS (Legat et al., 2013)."
"aPS are typically designed-to-order, i.e. they are unique systems, which are designed and implemented once a customer has awarded a contract to an aPS supplier (Birkhofer et al., 2010)"
"The specification and implementation is carried out in the form of a project (VDI/VDE 3695 Part 2, 2010)."
"The development of these (partial) solutions follows a typical product development workflow (cp. upper part of Fig. 1), as described e.g. in VDI/VDE 2206 (2004), and is decoupled from the projects on the timeline. "
"The categorization is based on and extends the one introduced in Ladiges et al. (2013), Vogel-Heuser et al. (2014c) and (2014d)."
" Anticipated software changes in accordance to Buckley et al. (2005) are software changes, which “can be foreseen during the initial development of the systems and, as such, can be accommodated in the design decision taken”. "
"Unanticipated software changes according to Buckley et al. (2005) are not foreseen during the development phase, but they are frequently undertaken at short notice during commissioning and operation in order to, e.g., clear defects in other disciplines, such as an unexpected behavior of the mechanics. "
"The PPU performs a manufacturing (discrete) process and handles, stamps and sorts different kinds of workpieces (Fig. 3) (Vogel-Heuser et al., 2014d)."
"Regarding Buckley et al.'s (2005) criteria temporal change, also history of change is introduced with the characteristic sequential and parallel synchronous and parallel asynchronous changes."
" Accordingly, the development of requirements on a production plant is an integrated part of the production design (Blanchard, 2004; Buede, 2000). In the development process model described in (VDI/VDE 2206, 2004) (cp. Section 2) for the design of mechatronic systems, such as production plants, the phases of identification and documentation of requirements are explicitly foreseen at the beginning of the process. "
"Similarly, other common development process models like the spiral model (Sage and Rouse, 2009) (for software-intensive systems) or the waterfall model include requirements elicitation and specification as a (repetitive) action during engineering. "
" Quality requirements, also called non-functional requirements or extra-functional requirements, are usually more general and include, among others, performance requirements expressed in Key Performance Indicators (KPIs) (see e.g. ISO 22400-2, 2012), flexibility requirements, reliability and availability requirements, safety and security requirements, and maintainability requirements (ISO/IEC 25010, 2011)."
"Unfortunately, the adaptation of the formal specification is often omitted, especially when changes need to be implemented within a short time window and during operation (Vogel-Heuser et al., 2014a)."
"The main requirements to be considered are reliability, performance efficiency, compatibility, maintainability and portability (Frank et al., 2011)."
"General sources of requirements are usually stakeholders, documents, and systems in operation (Pohl and Rupp, 2011). "
" Haubeck et al. (2013), for example, derive four stages in the requirement hierarchy of a single system. "
"Similar hierarchies can be found in the other literatures, like Blanchard (2004) and IEEE-Standard 1220 (1999). However, the hierarchy presented by Haubeck also refers to the process of formalizing requirements."
"Formalization may be a first refinement of the informal requirements (VDI/VDE 3694, 2008). However, informal requirements sometimes need to be defined on several or each hierarchical level (IEEE-Standard 1233, 1998)."
"Formalization usually results in a set of models, and the variety of used models is huge, and the choice of the right model type depends on the domain, industry branch, as well as the specific plant to be designed (VDI/VDE 3681, 2005). The right model choice also depends on the degree of granularity and the current refinement stage."
"These properties can be operationalized in a way that they are measurable by the available online measurements (Ladiges et al., 2013). "
"Feldmann et al. (2014b) presented a light weight notational approach (cp. 3.3) to model requirements for testing and evaluated it with experts from industry showing that the modeling approach provides the means to systematically, comprehensively and efficiently specify mechatronic sub-systems as sensors and actuators. "
"To increase the quality of requirements Rösch et al. (2015) and Teufl and Hackenberg (2015) introduced description of behavior based on MSCs included in the MIRA (Broy and Stølen, 2001) approach and UML SD."
"An important part of the system design is the definition of components and interfaces, which in software engineering is called the architectural configuration (Barais et al., 2008; Medvidovic and Taylor, 2000). During evolution, the engineers working on the different parts of the architecture will evolve their respective system parts."
"The complete system design covers different aspects (Goldschmidt et al., 2012). "
" In a multiple-case embedded system case study in 5 large software companies (Martini et al., 2014), different factors for architectural technical debt have been identified, like pressure to deliver, prioritization of features over products, non-complete refactoring, or technology evolution."
"CONSENS (Anacker et al., 2011) – CONceptual design Specification technique for ENgineering of complex Systems – is a method and specification language that targets the overall, discipline independent system design. "
"The MechatronicUML (Heinzemann et al., 2013) is a modeling language and process for the engineering of mechatronic systems. It is based on a rigorous specification of structure and behavior based on a refinement of the Unified Modeling Language (UML) (Object Management Group, 2011). "
"SysML4Mechatronics (Kernschmidt and Vogel-Heuser, 2013) is a language for interdisciplinary modeling, which addresses mechanical, electrical/electronic and software aspects in product automation and for aPS explicitly."
