"As in Shaw (1998) and Ropke and Pisinger (2006), a parameter P ≥ 1 is used in all worst removal operators to introduce some randomness in the selection of jobs, thereby avoiding the same jobs to be removed over and over again."
"For a detailed discussion of these operators, the reader is referred to Ropke and Pisinger (2006) and Pisinger and Ropke (2007)."
"To diversify the search, a noise term may be added to the objective functions of the insertion heuristics (Pisinger & Ropke, 2007; Ropke & Pisinger, 2006)."
"However, the parameter values that have been applied are based on both real-life data of two Viennese companies and real-life-based benchmark data for a related problem (Hiermann et al., 2015)."
Four types of instances may be distinguished based on the travel cost and travel time matrices used. The first three types are based on the travel time matrices for car and public transportation provided by Hiermann et al. (2015) and are generated using OpenStreetMap.
"Several quality indicators have been proposed in the literature to evaluate approximations of the Pareto frontier generated by heuristic solution procedures (Knowles, Thiele, & Zitzler, 2006; Zitzler, Thiele, Laumanns, Fonseca, & Grunert da Fonseca, 2003)."
"The hypervolume indicator (IH(A)), introduced by Zitzler and Thiele (1999), measures the portion of the objective space that is weakly dominated by an approximation set A."
"Technical debt (TD) is a metaphor used to describe a situation in software development, where a shortcut or workaround is used in a technical decision (Kruchten et al., 2012b)."
"TD has also similarities to three aspects of financial debt: repayment, interest, and in some cases high cost (Allman, 2012)."
"In software development, a shortcut or workaround can give the company a benefit in the short term with quicker release to the customer and an advantage in time-to-market over the competition (Kruchten et al., 2012a; Yli-Huumo et al., 2015a). "
"However, if these shortcuts and workarounds are not repaid, TD can accumulate and hurt the overall quality of the software and the productivity of the development team in the long term (Zazworka et al., 2011b)."
"The current literature has identified and developed some tools and practices to conduct TDM. However, according to a recent mapping study, the problem is the lack of empirical evidence about TDM in a real-life software development environment (Li et al., 2015a)."
"For data collection and analysis, we used the eight TDM activities identified by Li et al. (2015a) in semi-structured interviews to gather empirical data about TDM in the selected software development teams."
"We used the exploratory case study method (Robson, 2002) to answer the following main research question:"
"Technical debt management can be separated into the following activities: identification, measurement, prioritization, prevention, monitoring, repayment, representation/documentation, and communication (Li et al., 2015a). "
"There are a number of possible methods, models, practices or tools for every TDM activity (Li et al., 2015a). They have been developed and suggested in the literature, but they lack empirical evidence of their usability and functionality (ibid.). "
"Some software development teams may use more time on TDM, while some development teams may not pay much attention to it (Power, 2013). Therefore, it is important to understand if it is possible to distinguish between different maturities of TDM, similarly as in the capability maturity model (CMM)(Paulk et al., 1993). The results of this study can be used to develop a similar maturity model for TDM, which researchers and practitioners could use to conduct more research, or to improve companies’ internal and external practices."
"The TD metaphor was first associated with compromises on the code level of software (Cunningham, 1992). In addition, terms like code smells (Fowler et al., 1999) have described situations where poor technical choices in software development have caused problems in code quality and architectural soundness. However, the TD metaphor has been rapidly expanded after the initial concept on the code level, and it has been associated with other stages of the software development lifecycle as well (Tom et al., 2013; Alves et al., 2014)."
"The TD metaphor was first associated with compromises on the code level of software (Cunningham, 1992). In addition, terms like code smells (Fowler et al., 1999) have described situations where poor technical choices in software development have caused problems in code quality and architectural soundness."
" However, the TD metaphor has been rapidly expanded after the initial concept on the code level, and it has been associated with other stages of the software development lifecycle as well (Tom et al., 2013; Alves et al., 2014)."
"The current literature identifies such terms as requirements (Brown et al., 2010), design (Zazworka et al., 2011b; Zazworka et al., 2011a), architectural (Nord et al., 2012), test (Brown et al., 2010), process (Lim et al., 2012), documentation (Kruchten et al., 2012a), and people debt (Kruchten et al., 2012b) to demonstrate the same effect of shortcuts or workarounds happening in the other stages of the software development lifecycle."
"Shortcuts and workarounds in software development usually happen for intentional reasons, such as for business deadlines and development complexity (Yli-Huumo et al., 2015a)."
"Time-to-market and customer feedback are important factors for companies’ success, and it is essential to deliver solutions on time (Lim et al., 2012). This is the reason why business stakeholders are often more focused on deadlines and customers than the actual quality of the software, which is more in the developers’ interest area (Barney et al., 2008; Boehm, 2006). Therefore, strict deadlines may sometimes force the development team to create solutions with second-tier quality to meet the requirements within the deadlines set by the business stakeholders (Yli-Huumo et al., 2014)."
"TD can also occur unintentionally (McConnell, 2007). The reason for unintentional TD can be lack of competence, a need to upgrade existing technologies, or a customer or market -induced need for change"
"When taking TD, companies are able to speed up the release cycles to the customer, which can increase customer satisfaction and provide advantage in the market. Another benefit for companies is customer feedback (Yli-Huumo et al., 2015b). Companies are able to adjust the product and its business model based on faster customer feedback"
"According to some scholars, TD should be associated only with intentional decisions happening in the code base, and messy code should not be counted as TD, while some think that old technologies in legacy software should also be counted as TD (Norton, 2009; Fowler, 2009)"
"Even though concepts such as social debt (Tamburri et al., 2013) and people debt (Alves et al., 2014) describe similar phenomena of having shortcuts and non-optimal solutions in software development and organization, we believe that they should be categorized as sources for TD rather than as actual TD"
 Li et al. (2015b) have also developed similar TD list management for architectural technical debt (ATD).
" Implementing coding standards to the development process can prevent TD, when the developers have a cohesive way to produce a similar style code, which makes it readable and modifiable (Green and Ledgard, 2011)."
"Code reviews can be used to check other developers' solutions before the release to catch possible TD issues in the design (Mantyla and Lassenius, 2009). Also simple practices in agile methodologies, such as the Definition of Done practice can reduce TD in the early stages of development (Davis, 2013)."
" A similar approach has also been used by other researchers to identify and document TD issues in order to make TD easier to manage (Zazworka et al., 2013)."
"Klinger et al. (2011) interviewed four experienced software architects to understand how decision-making regarding TD was conducted in an enterprise environment. The results showed that the decisions related to TD issues were often informal and ad hoc, which led to a lack of tracking and quantifying the decisions and issues."
"In addition, an interpretive case study aims at understanding phenomena through the participants’ interpretation of their context (Runeson and Höst, 2008)."
"We decided to use semi-structured interviews (Charmaz, 2014) for data collection, which makes this research a flexible study (Runeson and Höst, 2008). Semi-structured interviews include a mixture of open-ended and specific questions, designed to elicit not only the information foreseen, but also unexpected types of information (Seaman, 1999)."
The analysis of causes and effects of TD is available as a separate publication by Yli-Huumo et al. (2014). The second reason for focusing more on TDM was the publication of the TDM mapping study by Li et al. (2015a).
"In exploratory case studies, the technique for the analysis of qualitative data is hypothesis generation (Seaman, 1999). "
"The data coding and analysis were completed in various steps, guided by the work of Robson (2002). "
Similar practices identified in a study by Codabux and Williams (2013) were reengineering and repackaging.
" A set of other practices for TD prevention have been identified in other studies (Codabux et al., 2014; Krishna and Basu, 2012). These practices include approaches such as education and training, pair programming, test-driven development, refactoring, continuous integration, conformance to process and standards, tools, and customer feedback (Codabux et al., 2014). "
"Developers may also value documentation differently, and they document only issues that they personally think are important (Lethbridge et al., 2003). "
"The literature has suggested approaches for TD prioritization (Eisenberg, 2012; Seaman et al., 2012; Theodoropoulos et al., 2011; Zazworka et al., 2011a). "
" Prioritization can also be based on customer needs, but this can leave the most important TD from the technical perspective out of sight (Codabux and Williams, 2013). These prioritization issues exist also in requirements prioritization (Lehtola and Kauppinen, 2006)."
"When a development team considers for example the criteria in SonarQube (2015) as TD, in can guide TD management and other TD activities. However, TD can also be considered to consist of issues of a larger scale, such as architectural or structural issues and technology gaps (Kruchten et al., 2012a). "
"The goal of TDM is to provide practices and tools to manage and reduce TD during software development (Li et al., 2015a). "
"External validity is concerned with ‘to what extent it is possible to generalize the findings, and to what extent the findings are of interest to other people outside the investigated case’ (Runeson and Höst, 2008, p. 154). "
"On the basis of our findings we believe that TDM in software development has similarities to the characteristics of the capability maturity model (CMM) (Paulk et al., 1993). "
"A similar maturity model to CMM is also adaptable in TDM, where development teams have different TDM maturities in activities and practices. This kind of maturity as a concept has been applied to other processes and domains as well (De Bruin et al., 2005)."
" Chen [7] used fuzzy numbers to determine the fuzzy reliability of the two systems, whereas Singer [12] used LR-type fuzzy numbers to consider the fuzzy reliability problem."
"Therefore, the triangular fuzzy numbers used by Chen [7] are R A=R B=(0.00888,0.02,0.03112;1)R C=R D=(0.75552,0.80,0.84448;1)R E=(0.94434,1.00,1.05566;1)R F=R G=(0.04722,0.05,0.05278;1)R H=(0.00944,0.01,0.10560;1) Using Definition 8, we defuzzified R X(1) and obtained the estimated reliability of the system in the fuzzy sense as dR X(1),0 =0.137755"
[C] Comparison of this study with that of Cheng and Mon [6].Cheng and Mon [6] considered the following:
"Existing models predict different vortex number densities and they are only valid for the inertial subrange of the energy spectrum of turbulent flows. No model is available which is valid for a wider range of flow situations [7,8]. "
" In addition the vortex number distributions should be used to derive expressions relating to the fractional rate of surface renewal and mass transfer coefficients across gasâliquid and solidâliquid interfaces [9]. For these reasons, a systematic evaluation of available models on vortex number density is required as a foundation for further investigations."
"Several Eulerian methods for flow structure visualization are proposed in the literature. They are generally formulated in terms of the invariants of the velocity gradient tensor. These criteria includes the iso-surfaces of vorticity, stream lines, Helicity, Q-criterion, complex eigenvalues of the velocity gradient tensor, Î»2, swirl strength and pressure minimum [21]. "
"The applications are of a wide range and significance, including gesture recognition and human computer interaction ( Bilalet al., 2012; Radlak and Smolka, 2012; Nalepa et al., 2014), objectionable content filtering ( Lee et al.,2007), image retrieval ( Kruppa et al., 2002), image coding using regions of interest ( Chen et al., 2003), and many more."
An approach introduced by Hsu et al. (2002) takes advantage of common skin color properties in nonlinearly transformed YCbCr color space using an elliptical skin color model
"Skin color can be modeled using a number of techniques, including the Gaussian mixture model ( Greenspan et al., 2001) and the Bayesian classifier ( Jones and Rehg, 2002)"
An approach for adapting the segmentation threshold in the probability map based on the assumption that a skin region is coherent and should have homogenous textural features was introduced by Phung et al. (2003)
"Analysis of facial regions for effective adaptation of the skin model to local conditions was investigated by Fritsch et al.(2002); Stern and Efros, 2002; Kawulok, 2008; Kawulok et al., 2013 and Yogarajah et al., 2012."
"Simple textural features were used to boost the performance of a number of skin detection techniques and classifiers, including the ANN ( Taqa and Jalab,2010), non-parametric density estimation of skin and non-skin classes ( Zafarifar et al., 2010 ), Gaussian mixture models ( Ng and Pun, 2011), and many more ( Forsyth and Fleck,1999, Conci et al., 2008, Fotouhi et al., 2009, Abin et al.,2009)"
"A number of skin segmentation techniques emerged based on this observation: Kruppa et al. (2002) assumed that the skin blobs are of an elliptical shape, a threshold hysteresis was applied by Argyros and Lourakis (2004) and recently by Baltzakis et al. (2012)"
"In the case of the DSA ( del Solar and Verschae, 2004), the ROC curves were obtained by applying different values of the diffusion threshold ( ), explained earlier in Section 2"
"In order to provide a thorough comparison, we also investigated how the wavelet-based method behaves when the textural features are extracted from the skin probability maps rather than from the luminance as proposed in the original work of Jiang et al. (2007)."
The analysis of skin probability map domain for skin segmentation using a controlled diffusion was proposed by del Solar and Verschae (2004)
"Although the color-based skin models can be efficiently adapted to a given image, it was proved by Zhu et al.    (2004)  that it is hardly possible to separate skin from non-skin pixels using such approaches"
Conditional random fields were used by Chenaoua and Bouridane (2006) to exploit spatial properties of skin regions
An approach based on the cellular automata for determining skin regions was proposed by Abin et al. (2009).
"Although empirical experiments have shown that it is practically usable on a wide range of programs ( Fraser and Arcuri, 2012), Genetic Algorithms are a global search technique, which tend to induce macro-changes on the test suite"
"For example, to generate tests for specific branches to achieve branch coverage of a program a common fitness function ( McMinn, 2004) integrates the approach level (number of unsatisfied control dependencies) and the branch distance (estimation of how close a branching condition is to being evaluated as desired)"
"However, there remain several different parameters ( El-Mihoub et al., 2006): How often to apply the individual learning? On which individuals should it be applied? How long should it should be performed? In EvoSuite, the choice of how often to apply local learning depends on two parameters: Rate: The application of individual learning is only considered every r generations"
"As the problem is too complex to perform a theoretical runtime analysis (e.g., such as that presented by Arcuri (2009)), we therefore aim to empirically answer the following research questions"
"This is different from the result of our initial experiment ( Fraser et al.,2013), where the best configuration used seeding, small population size (five individuals), low rate of local search (every 75 generations), and a small budget of five fitness evaluations for local search"
"A particular aspect of this real-life, unbiased sample of classes is that the problems it represents are quite different to those considered as difficult search problems ( Fraser and Arcuri,2012): for example, a large share of the classes have environmental dependencies that make high coverage with EvoSuite impossible"
"Methods by which such OSINT data may be used to increase effectiveness in this manner include (but are not limited to): selection of vulnerable personalities, inclusion of ploys personally attractive to the target, and impersonation of a person in authority ( Huber et al.,2009)."
"The nearest approximation we are aware of is Scheelen et al.(2012), who investigated a single company by connecting with followers on LinkedIn, where the social media structure is based around employment."
"Irani et al. (2009) suggest that a record-matching approach to the problem can be fruitful, with identifiers like last name, birth year and country unlikely to change across records"
"Working with a wider range of features, Malhotra et al. (2012) design an ensemble classifier, with subclassifiers relying on individual features such as profile pictures and usernames."
"Goga et al.(2013) exploit innocuous social media profile information such as time-stamps, geographical location and writing styles to match user profiles, demonstrating that even where usernames and other traditional identifiers are disguised, users can still be identified based on their usage of the media"
"The general identity resolution approach of pairwise comparison is supported even more broadly by similar approaches in other domains of security analytics ( Zhang et al., 2016)."
"Each interviewee held internationally recognised certification in the domain area, reaching a minimum level of CREST CRT , allowing level of expertise to be compared and verified to international standards ( Knowleset al.,2016)"
"Furthermore, Kotson and Schulz (2015) and Dewan et al (2014) propose that organisations could use natural language processing techniques to maintain awareness of their online footprint, to be compared with received phishing emails, allowing identification of collection of OSINT by an attacker, and potential early warning of an Advanced Persistent Threat (APT)"
neither general MV-algebras [19] nor even the special case of Łukasiewicz MV-algebra are considered in this paper.
"According to the most commonly accepted definition, Big Data is characterized by the 4 Vs  [3]: volume, velocity, variety, and veracity"
"From the business perspective, the goal of these technologies is to process fast input streams, obtain real-time insights, and enable prompt reaction to them  [4]."
The resurgence of interest in CEP and SP systems has been accompanied by the use of cloud environments as their runtime platform. Clouds are leveraged to provide the low latency and scalability needed by modern applications  [5–7].
"First, cloud environments are subject to variations that make it difficult to reproduce the environment and conditions of an experiment  [9]"
"Simulators have been used in many different fields to overcome the difficulty of executing repeatable and reproducible experiments. Early research into distributed systems  [10] and grid computing  [11] used simulators, as well as the more recent field of cloud computing  [12–14]."
CEPSim extends CloudSim   [12] using a query model based on Directed Acyclic Graphs (DAGs) and introduces a simulation algorithm based on a novel abstraction called event sets.
"This article significantly extends the authors’ previous work  [15] by improving the discussion about CEPSim’s goals and assumptions, by introducing the event set concept, by presenting detailed descriptions of all simulation algorithms and a thorough evaluation of CEPSim."
"The basis of Complex Event Processing (CEP) was established by the work of Luckham on Rapide   [10], a distributed system simulator.Later on, the concepts were generalized and applied to the enterprise context in another study by Luckham  [16]. At about the same time, the database community developed the first classical Stream Processing (SP) systems such as Aurora   [17] and STREAM   [18]. CEP and SP technologies share related goals, as both are concerned with processing continuous data flows coming from distributed sources to obtain timely responses to queries  [19]."
"In CEP systems, users create queries (or rules) that specify how to process input event streams and derive “complex events”. These queries have usually been defined by means of proprietary languages such as Aurora Stream Query Algebra (SQuAl)  [17] and CQL  [21]."
"Despite standardization efforts  [22], a variety of languages are still in use today. Cugola and Margara  [19] classify existing languages into three groups"
"Pattern-based: languages are used to define patterns of events using logical operators, causality relationships, and time constraints. The Rapide   [10] language is an example of this category."
"The recent emergence of cloud computing has been strongly shaping the Big Data landscape. Many authors have recognized the symbiotic relationship between these areas  [23–25], as cloud computing environments can be used to store and process Big Data and also to enable new models for data services. For instance, Chang and Wills  [26] used a cloud platform to store big biomedical data, whereas Grolinger et al.  [27] proposed a platform for knowledge generation and access using cloud technologies."
"Current CEP research has been strongly influenced by cloud computing too. For instance, TimeStream   [5], StreamCloud   [6], and StreamHub   [7] are CEP systems that use cloud infrastructures as their runtime environments."
The prevalence and success of MapReduce has motivated many researchers to work on systems that leverage its advantages while at the same time try to overcome its limitations when used for low-latency processing. StreamMapReduce   [29] and M3   [30] are examples of MapReduce-inspired systems intended for stream processing
"Simulators are a popular tool that has been used in Grid Computing research  [11,33] for many years."
"Because of its limitations, CloudSim has originated many extensions in the literature  [9,34,35]."
"Guérout et al.  [34], on the other hand, focused on implementing the DVFS model on CloudSim. Finally, Grozev and Buyya  [35] presented a model for three-tier Web applications and incorporated it into CloudSim."
"Finally, the iCanCloud simulator  [14] is similar to CloudSim, but it can also parallelize simulations and has a GUI to interact with the simulator. Its application model, however, is based on low-level primitives and needs to be significantly customized to represent CEP applications"
"For instance, most CEP systems based on imperative languages also use DAGs to represent user queries. This is the case with Aurora   [17], StreamCloud   [6], Storm   [31], S4   [32], FUGU   [37], and many others."
"Systems using declarative languages, on the other hand, create execution plans from queries that can often be mapped into DAGs  [5,18]. Even for pattern-based query languages, previous studies  [38] have shown that is possible to transform them into DAGs."
"A stateless operator, or simply an operator, can process incoming events in isolation with no dependency on any state computed from previous events. For example, an Aurora filter is an operator that routes events to alternative outputs based on attribute values  [17]."
"A scheduling strategy can fundamentally determine the performance of a CEP system by optimizing for different aspects of the system, such as overall QoS  [17] or memory consumption  [40]. Because of this significance, CEPSim also allows different scheduling strategies to be plugged in and used during a simulation."
"The queries used in the experiments in this section have been extracted from Powersmiths’ WOW system  [41], a sustainability management platform that draws on live measurements of buildings to support energy management. Powersmiths’ WOW uses Apache Storm  [31] to process in near real-time sensor readings coming from buildings managed by the platform"
"This validation approach is similar to the ones adopted by other simulators, such as NetworkCloudSim  [9], iCanCloud  [14], and Grozev and Buyya  [35]."
"This experiment analysed CEPSim’s behaviour when simulating multiple queries running concurrently. To do so, first a Storm cluster was created at the Amazon EC2 service  [45]"
