"The Chen system is a special case of the Lorenz system and The Lu system is a particular case of the Lorenz system of [2,3] may lead to the conclusion that the study of the Chen and the Lu systems is useless, the Chen and the Lu systems stimulate the development of new methods for the analysis of chaotic systems."
The estimate from above of the Lyapunov dimension by Lyapunov functions [36] and its comparison with the local Lyapunov dimension in zero stationary point permit one to obtain the exact formula of dimension for a generalized Lorenz system (9) with a certain parameter d
" In the mechanical and mathematical literature concerning the models for piezoviscous hydrodynamic thin film lubrication problems, different classical devices have been considered, such as journal-bearings, rolling-bearings or rolling-ball-bearings (see [1], for example). "
"In these more complex settings, this way of including piezoviscous regimes has given rise to several mathematical analysis results that state the existence and the uniqueness of solution, as well as to the design of suitable numerical methods to approximate the corresponding solutions, for which there are no analytical expressions (see, for example, [4-8])"
"For the spatial discretization we consider a classical piecewise linear Lagrange finite element space, so that the discretized problem consists of finding p hn+1 Kh, such that (38) - /2 /2G(t,p hn)(p hn+1) ( h-p hn+1) dt -6 - /2 /2h ( h-p hn+1)dt, h Kh,where Vh denotes the finite element space (see [22], for example): Vh={ h C0( )/ h|E P1, E h},"
"In order to apply the duality method in [20], we introduce the indicatrix function of the convex Kh denoted by IKh, so that the variational inequality of first kind (38) can be transformed in the equivalent variational inequality of second kind that consists of finding p n+1 V0h, such that - /2 /2G(t,p n)(p n+1) ( -p n+1) dt+IKh( )-IKh(p n+1) -6 - /2 /2h ( -p n+1)dt, V0h.Moreover, we use the notation (Anp n+1, )= - /2 /2G(t,p n)(p n+1) ( -p n+1) dt,(fn, )=-6 - /2 /2h ( -p n+1)dt.Then, using the tools of subdifferential calculus, we obtain that (39) n+1=-(Anp n+1-fn) IK(p n+1),where IKh denotes the subdifferential of the indicatrix function"
"In order to apply the results in [20], for a given parameter >0, we introduce the new variable (42) n+1 IKh(p n+1)- p n+1.In terms of this new variable n+1, the equivalent formulation to (40) (41) can be written in the form:"
"The idea is to make a comparative analysis of the different models, formulations and numerical schemes presented in the previous sections, mainly taking as a reference the data set of the numerical examples in [12]"
It seems that the results obtained with the numerical schemes here implemented for the Rajagopal and Szeri model are very similar to the solution presented in [12]
"Predicting the effort required to create software has been based on numerous software size models such as the Constructive Cost Model (Anandhi and Chezian, 2014; Clark, 1996; Manalif et al., 2014) and all its alternatives (Attarzadeh and Ow, 2011; Kazemifard et al., 2011; Tadayon, 2004; Yang et al., 2006) as well as on function points (Borandag et al., 2016) and analogy based models (Idri et al., 2015). The main goal of all these approaches is to minimize prediction error. Prediction is needed during the initial phase of software project developments."
"As reported in Silhavy et al., (2015a,b) UCP has some important drawbacks. Several approaches help identify the drawbacks of the UCP method and offer solutions, many of which are based on an analogy approach."
"Analogy based size estimation is commonly used for prediction in all the methods mentioned above (Idri et al., 2015; Shepperd and MacDonell, 2012). "
"The UCP method is based on use case models, which are commonly used as functional descriptions of proposed systems or software. The method involves assigning weights to groups of actors and use cases. Karner's original UCP method (Karner, 1993) identifies three groups: simple, average and complex."
"A number of use case scenario steps are typically involved in the initial estimation process. There have also been several modifications of the original UCP principles including use case size points (Braz and Vergilio, 2006), extended UCP (Wang et al., 2009), modified UCP (Diev, 2006), adapted UCP (Mohagheghi et al., 2005), and transaction or path analysis (Robiolo et al., 2009)."
"This approach is based on analysing a scenario, not step by step, but using steps merged logically into so-called transactions in which each transaction should include more than one step. Robiolo et al., (2009) improved transactions by calculating paths by which the complexity of each transaction is based on the number of binary or multiple conditions used in the scenarios"
"Their approach is based on Robiolo and Orosco (2008), where number of transactions is equal to the number of stimuli. A stimulus is a system entry point, which generates response (transaction) of an actor action in a use case. "
"Ochodek et al., (2011a) discusses a reliability of transaction identification process and Jurkiewicz et al. (2015) discusses event identification in use cases, which should be useful for path identification"
"Diev (2006) noted that when the actors and use cases are precisely defined, unadjusted UCP (the sum of the UAW and the UUCW) can be multiplied by the technical factors. The product of the technical complexity factors (see Table 3) and unadjusted UCP is considered as the coefficient of the base system complexity in Diev (2006)."
"According to Nageswaran (2001), added effort must be taken to consider support activities such as configuration management or testing."
"Yet another modification to the UCP is called adapted UCP (Mohagheghi et al., 2005). In this method, the UCP method is adapted to provide incremental development estimations for large-scale projects. Initially, all actors are classified as average (based on the UCP native classifications) and all use cases are classified as complex. "
"Ochodek et al., (2011b) also proposed omitting UAW and the decomposition of use cases into smaller ones, which are then classified into the typical three use case categories."
"Analogy based estimation methods are discussed in Azzeh et al., (2015b), which evaluated 40 variants of the single adjustment method using four performance measures and eight test datasets."
Amasaki and Lokan (2015) addressed the problem of selecting projects using a linear regression model by testing the window principle. The window principle involves first selecting a subset of the data.
"Instead, the study by Urbanek et al., 2015b is based on artificial intelligence and is an application of the approach proposed by Senkerik et al., (2014) but with theoretical aspects of Oplatkova et al., (2013). Urbanek et al., 2015b used a symbolic regression tool, analytic programming, together with differential evolution."
"Several works have attempted to apply various prediction models to UCP. Nassif et al., (2013) presented a linear regression model with a logarithmic transformation that they created to estimate software effort from use case diagrams."
" In Nassif et al., (2011), a multiple linear regression model was developed to predict the values of the productivity factor. To adjust the values of the productivity factor, they first employed a fuzzy logic approach (Nassif et al., 2011). Then, they created an artificial neural network (multi-layer perceptron) model (Azzeh and Nassif, 2016; Nassif et al., 2015; Nassif et al., 2012, 2013)."
"Actors play roles in the UAW variables (Azzeh et al., 2015a; Silhavy et al., 2015a). A simple actor typically represents an application programming interface and a complex actor represents a human using a graphical user interface."
"The least squares method is the most common method used to fit a regression line. The case when a linear regression has only one independent variable is called simple linear regression (Bardsiri et al., 2014; Jorgensen, 2004; Montgomery et al., 2012; Shepperd and MacDonell, 2012), whereas multiple linear regression (Bardsiri et al., 2014; Jorgensen, 2004; Montgomery et al., 2012; Shepperd and MacDonell, 2012) involves more than one independent variable."
"Another type of linear regression is polynomial regression (Bardsiri et al., 2014; Jorgensen, 2004; Shepperd and MacDonell, 2012) in which the relationship between the dependent variable and the independent variables is modelled as an mth degree polynomial"
"In the case of multiple independent variables it is appropriate to use stepwise regression (Bardsiri et al., 2014; Jorgensen, 2004; Shepperd and MacDonell, 2012). The aim of the stepwise regression technique is to maximize the estimation power using the minimum number of independent variables. "
"The experiment described above was evaluated using two datasets. Dataset 1 was obtained from Silhavy et al., (2015a), in which the dataset was based on Ochodek et al., (2011b) and Subriadi and Ningrum (2014). The UAW, UUCW, TCF, and ECF are known from the UCP method."
"We can conclude that the UAW also has an effect on size estimation, which is different than the findings published previously in Ochodek et al., (2011b). Here, the UAW values were valuable because the number of actors helps determine the number of interfaces required in the project, which, in turn, impacts software product construction."
"Human motion estimation is one of the most important areas of computer vision study [1–11]. It refers to the automated prediction and estimation of human motion posture based on rigid body motion, joint angles and body segment location."
"Previous studies have shown that the performance of motion estimation is highly dependent on the quality of motion data as well as the algorithm that is developed for modeling and estimation of the model [1,4,8,9,11]. The quality of motion relies on the method of captured data, either by marker-based or marker-less motion capture. "
"The approaches to motion estimation are biomechanical based [5,7], silhouette based [2,3,6,11,12] and image based [1,4,8–10]. A biomechanical-based approach involves tissue analysis and bone and joint location, which requires expensive devices and equipment."
"The approaches to motion estimation are biomechanical based [5,7], silhouette based [2,3,6,11,12] and image based [1,4,8–10]. A biomechanical-based approach involves tissue analysis and bone and joint location, which requires expensive devices and equipment. Silhouette-based estimation is analyzed by the silhouette extract from a human image file. It is always challenging when the estimation involves more than one subject. Image-based estimation involves the extraction of still figures from video motion data."
"The methods used for estimation include cross-entropy regularization [1], Artificial Neural Network (ANN) [8], hierarchical fitting [9] and human pose recovery [10]."
" The model is applied to short temporal daily activities include walking, running, and jumping obtained from publicly available video [25–27]and experimental captures of Yoga motion activity."
"Typically, motion postures in the whole time duration are framed in image snapshots similar to those presented in Wang and Baciu [1], Tong et al. [4], Zhang et al. [8], Shen et al. [9] and Hofmann and Gavrila [10]. The images are transformed into numeric data in a 2D coordinate system of the main body joints"
"Instead of using the point-cluster technique and the Kalman filter approach as in the case of Wolf and Senesh [7], we use a polynomial fitting approach. Polynomial fitting has been used in the estimation of air quality [28] and for operator prediction in image processing [29]. "
"In addition, classification performance is compared between the actual and estimated model data aided by the Waikato Environment for Knowledge Analysis (WEKA) software [30]. The classification processes are tested on 34 built-in algorithms for the seven categories of classifiers: Bayes, Function, Lazy, Meta, Misc, Rules and Trees. "
Human motion is often represented by the original motion frame or by representing the original motion frames with a parametric or probabilistic model [31]
" By creating parameterized motions, human action can be altered based on momentary moods that describe emotions such as happiness and sadness [32]. At the same time, the motion style can also be modified by adjusting the stylistic parameter as in the work by Brand and Hertzmann [33], in which a statistical model was introduced to generate new motion sequences based on the number of stylistic degrees of freedom."
"On the other hand, motion estimation is the process of estimating the configuration of the underlying kinematic or skeletal articulation structure of a person [34]. It often begins by video motion capture or analysis of the available motion dataset. In the past, different models have been proposed to simplify captured motion matching, including sticks to indicate the human skeleton as well as ellipsoids and cylinders to represent solid human models [35]. "
"Gait motion analysis often studies walking movements, focusing on the lower body segments: the thigh, lower leg and foot. For instance, Veeraraghavan et al. [36] created a shape-based recognition system for gait motion while Zhang et al. [37] proposed a visual gait generative model (VGGM) and a kinematic gait generative model (KGGM) to represent part or whole gait modelling."
Shen et al. [12] used a Gaussian process to study the low-dimensional manifold of visual input data to reconstruct the corrupted silhouette for motion estimation. 
 Luo et al. [11] proved that multi-view video is efficient in solving high-dimensional space problems and estimating a 3D surface in a temporal sequence. 
"Biomechanical-based approaches involve the analysis of soft tissue, bone and joint locations in the human body. For this purpose, Xiao et al. [5] performed an optical motion data capture via a marker-based approach. Their method uses biomechanical information based on 28 infrared markers placed on the human body. Estimation was possible using human skeleton mapping."
" Wolf and Senesh [7], on the other hand, proposed a numerical model with no consideration for mechanical properties. They focused on the soft tissue deformation and bone position of the human body using a statistical solid dynamic method. "
"Of all of the approaches, the image-based approach is the most common method for motion estimation; an example is the monocular image sequence, a model-based approach whereby the object shape is employed in motion estimation, and an independent method is used for a priori shaped models [1]. "
"An example of object shape employment in model estimation was presented by Tong et al. [4], who estimated the joint and global location parameters of a human pose based on a monocular image using the deterministic nonlinear constraint optimization method. "
" In addition, an optical flow method to estimate the motion of gestures was proposed by Zhang et al. [8]. The optical flow method was applied on the flat surface of images to segment and recognize the gestures. ANN has also been used to estimate gesture patterns. "
Another simple and straightforward approach by Daubney et al. [41] was the sparse set of features for pose estimation in low-level motions. Low-level motion suffers from perturbations such as noise and occlusion. The strength of their method is that it can be used in low-level motions without the need for pose initialization. 
"Whereas the studies on low-level motion focus on a single type of motion activity, Bruderlin and Williams [51] proposed a time-warping method as a non-linear method to combine different movements and control the speed of motion."
"Nanni et al. [17] and Saripalle et al. [18] proposed methods using support vector machine for three orthogonal planes of motion data and posturography data, respectively. "
"To achieve a perfect fit on every segment model, the BB segment has a 2nd order polynomial fitting, while the UB and LB have a 6th order of polynomial fitting in our motion model. Another approach that is similar to the polynomial fitting adopted here is the piecewise polynomial that is commonly used in the temperature data of heat transfer [58]."
"The missing data contributes approximately 12.8% of the overall study data. Therefore, the data elimination cum regression imputation approach as reported in Chan et al. [62] is applied to eliminate and impute the missing data."
"Despite assertions some thirty-five years ago that “thefuture of operational research is past” (Ackoff, 1979), the tech-niques and methodologies are still taught in universities across theglobe and regularly used in business decision-making, in both thepublic and private sectors. "
"Many organisations have changed the name oftheir departments to include analytics; such as IBM’sBusiness Analyt-ics and Mathematical Sciences(Sutor, 2013) and Proctor and Gamble’sGlobal Analytics(Ericson, 2006) teams"
"This conclusion confirms that periodization is not only the product of theory, but it is also a producer of theory (Green, 1995). "
"Whilst examples of data mining and machine learning algorithms applied within distributed systems are numerous (e.g. Zaki & Ho, 2000), no academic literature on the application of OR/MS methods within these new architectures was found."
"The bioinformatics analysis reveals that many human diseases, such as cancer, cardiovascular disease, amyloidoses, neurodegenerative diseases, and diabetes, are correlated with proteins diagnosed to be disordered [1,2]."
"The nuclear Poly(A)-Binding Protein 1 (PABPN1) induces the formation of muscle Intranuclear Inclusions (INIs) that are the pathological hallmarks of OPMD. There is currently no cure for OPMD [2,4]."
"In image analysis, the HSV (Hue, Saturation, Value) transformation is useful for developing image processing algorithms based on descriptions of colors that are natural to humans [16]."
There are existing nonlinear functions of features known to be effective (which can be interpreted as mathematical expression models) [17-21]. 
" The Expectation Maximization (EM) is a widely used approach to learning in the presence of unobserved variables, such as in the applications of fitting high-dimensional Gaussian mixture models [24] and reducing the difference in feature distributions [25]."
"Mathematical morphology provides an approach to extracting image components, such as size, shape, boundary and connectivity, and to eliminating irrelevancies for detecting various blood cells [11,12] and cancer cells [13]."
" Yet, the graphical model method, with a prior knowledge of object shapes, is able to provide a probabilistic model to represent the relationship among the image pixels, region labels and underlying object contour [7]."
" Since each iteration of the algorithm consists of an Expectation step (E-step) followed by a Maximization step (M-step), we call it the EM algorithm [26,27]."
"The advantage of the cross-validation is that each training/test subset is independent of the others [33,34]"
"According to a recent survey of 600 software developers, managers, and executives in the United States and the United Kingdom, only 3% of the respondents said they had no plans to adopt CD ( Perforce Software Inc 2015)."
"However, implementing CD can be quite challenging ( Chen, 2015, Leppanen et al., 2015, Claps et al., 2015 "
"Although CD as a goal (a target state) is no longer a new idea and has been well documented ( Humble and Farley, 2010), the adoption journey for CD is not yet a smooth path"
"Many times, these releases would be followed by P1 (priority 1) incidents ( Rob, 2007), meaning that release activity was always full of uncertainty, failures, and stress"
"According to this distinction, Continuous Delivery is compatible with a wide range of scenarios, but Continuous Deployment is suitable only under special conditions ( O'Dell and Skelton, 2016)"
"For example, in our organization, we needed to create a change ticket, place the change request on the agenda of the next Change Advisory Board (CAB) meeting ( Rob, 2007), present the change at the meeting, receive CAB approval, confirm the deployment window, and so forth."
"However, little, if any, work has been reported that specifically seeks to understand and address this important type of software ( Rodr guez et al.,2016)."
"Recent years have witnessed tremendous growth in video traffic on the Internet as a result of higher broadband data rates, proliferation in smart handheld devices [24,95]and affordable unlimited data plans offered by Internet Service Providers [51]."
An estimated one-third of all online activities on the Internet is spent watching video according to the recent report [100]. 
" Netflix alone is reportedly streaming over 1 billion h of video each month which is equivalent to almost 7,200,000 Terabytes of video traffic [37], and this figure is rising constantly. "
"The skyrocketing demand for serving video traffic have questioned the effectiveness of the traditional solution of employing special purpose Content Delivery Networks (CDNs), to serve such content. Invented at the turn of the century [96], CDNs now constitute the backbone for serving content [25,80]. "
"Although replacing selfish self-organising swarming with centrally managed P2P content exchange can improve completion rates considerably [81], for CDN-grade reliability, peers would still need to stick around to allow other users in the swarm to complete, or to maintain a distributed copy of the entire content item across the set of active users in the swarm."
"In short, PA-CDNs work as follows: Whenever possible, i.e., whenever there is sufficient capacity to deliver content in the swarm, peers distribute chunks of content amongst each other (typically using centrally managed swarming techniques [81,93,124])."
"Unlike the previous study [66], we analyze a significantly wider range of obstacle factors, including not only the traditionally discussed technical challenges such as reliability and QoS, but also various other factors, including heterogeneity and scale, and inhomogeneous distribution of resources among users."
"Our work, with its focus on deployable peer-assisted content delivery, is complementary to several survey articles which have focused on traditional P2P-based content delivery [7], or on specific P2P issues such as P2P overlay construction [68], or chunk scheduling [62]. "
"The closest work is that of Lu et al. [66], which surveys the design space of PA-CDN architectures, and highlights a fundamental choice between a tightly coupled or loosely coupled model of co-operation between the server-assisted and peer-assisted components of the PA-CDN"
The request-routing system in CDNs typically includes two basic modules for routing user requests to the most suitable edge server; i) request-routing algorithm and ii) request-routing mechanism [80]. 
"A special purpose DNS server is programmed to redirect users’ requests to the IP address of an appropriate edge server by considering some important parameters such as load on edge server and its distance from the client, network proximity, and user perceived latency [19]."
"Content Delivery Network is a complex content distribution system and several issues and decisions are involved in managing and administrating the entire CDN infrastructure, including, where to place edge servers [18], what content to replicate [32,48,97], and on which cluster of servers to copy each piece of content [8]. "
To provide a cheap pay-as-you-go service to a broad variety of customers some CDNs have adopted cloud technologies which became known in the literature as cloud CDNs [4]. 
"Last but not least, multiple telecom operators (AT&T, BT, Orange, Telefonica, KPN and Verizon among others) to gain a better control over the data services served to their users have deployed their private telco-CDNs [16,30]."
"Overall, Cisco has estimated that content delivery network traffic will carry nearly two-thirds of all Internet video traffic by 2020 [24]. Yet, several recent studies have reported that CDNs are being stressed by the demands placed during peak hours [60,109]. In a search"
"when users agree to share their resources in return of access to the system - the content swarms are said to be self-scalable [28]- as an increase in demand for a content item yields an equal increase in the number of the content suppliers [73,83]. "
"Some peer-to-peer applications may rely on dedicated nodes to control, coordinate and manage content swarm. This structure is referred to as partially centralized P2P system  [88]"
"Similarly, PPLive - the largest P2P live streaming service - rely on dedicated Trackernodes to store the information about streaming channels, available video chunks and peers [40]. Some versions of Bit-Torrent - a popular file sharing P2P system - also rely on Tracker nodes to distribute bulk software updates or multimedia files [88]."
"For instance, the authors of [7] present a critical analysis on different design features and infrastructural properties of P2P systems and their influence on non-functional aspects such as scalability, resource management, security, fairness and self-organization"
"A comprehensive survey of various techniques proposed for structured and un-structured P2P networks has been presented in [68]. Similarly, the authors of  [62] provided an overview of different approaches to address chunk scheduling techniques and peering mechanisms."
