" Mingers (1997) describes these as the “intellectual resources” that the researcher brings into an intervention, and it is important to be able to distinguish whether problems encountered in the use of a method derive from the limitations of the method itself or from the inadequate resources of the researcher. "
"Our questionnaire was first developed in the context of a research programme aiming to generate and evaluate new systemic problem structuring methods for use in promoting sustainable resource use (Winstanley et al., 2005; Hepi et al., 2008)."
" Because of the latter, the questions had to be reasonably generic. Other authors suggest a number of different ways of producing generic evaluation criteria, and these have been summarised by Beierle and Konisky (2000) and Rowe and Frewer (2004)."
"facilitating consultation with land owners and community interest groups as part of a feasibility study for the construction of a new water storage dam (Winstanley et al., 2005)."
"working with an Australian NGO and its stakeholders in exploring policy options to address the public injecting of illicit drugs (Midgley et al., 2005);"
"facilitating workshops with the police and other stakeholders in the New Zealand criminal justice system to look at ethical issues associated with anticipated future developments of forensic DNA technologies (Baker et al., 2006);"
"reviewing the process used by the New Zealand Ministry of Research, Science and Technology to develop ‘roadmaps’ for long-term investments in environment, energy, biotechnology and nanotechnology research (Baker and Midgley, 2007)"
"developing a new collaborative evaluation approach in partnership with regional council staff responsible for facilitating community engagement in sustainability initiatives (Hepi et al., 2008)."
"At its most flexible, a pluralist practice may involve the integration of several previously distinct methods into a new whole, perhaps also incorporating the design of novel elements (Midgley, 2000)."
"The field of numerical algebraic geometry [3,24] includes a wide array of algorithms for finding and manipulating the solution sets V(f) of polynomial systems, including both isolated solutions (points) and positive-dimensional solution sets (curves, surfaces, etc.)."
"All isolated solutions have associated to them a positive integer, the multiplicity of the solution, which is greater than 1 for singular solutions [3]."
"Section 5, we describe the connection of this perturbation approach to the deflation approach of [9], the method of regenerative cascade [10], and a very early technique in the field known as the cheaterâs homotopy [17] in which the authors made use of a perturbation of fË(z) for somewhat different reasons. It is important to note that our perturbation is virtually the same as the cheaterâs homotopy, in the case where there are no parameters."
"It is observed in [17,24] that a perturbation can cause positive-dimensional irreducible components to âbreakâ into a (possibly very large) number of isolated solutions."
" The major software packages for carrying out such computations include Bertini [2], PHCpack [25], and HOM4PS-2.0 [13]."
"One very special type of homotopy is the parameter homotopy [17,19]"
This and other optimizations of regeneration are described in [9]
"Much of the theory underlying the ideas of this article was known by Morgan and Sommese in the 1980s [18] and has since been repeated in various forms, for example in [24,8]"
"Let rk(f) denote the rank of the polynomial system f(z), i.e., the dimension of the closure of the image of f(z), f(CN)â¾âCN. The rank of f(z) is an upper bound on the codimension of the irreducible components of V(f) [24]"
It should be noted that this theorem is in fact a corollary to the main result in [17].
 Regeneration can compute all of these nonsingular solutions [9]
"First, we may trivially compute the multiplicity, Î¼(zi), of each isolated solution zi of f(z)=0, as defined in [24]"
"This is based on the fact, proved as Theorem A.14.1(3) in [24], that each isolated solution zi will be the endpoint of Î¼(zi) paths beginning at points in V(f-pË)"
In this section we consider several examples where perturbed regeneration provides some benefit. All runs made use of Bertini 1.4 [2]. All reported timings except those of the last example come from runs on a 3.2GHz core of a Dell Precision Workstation with 12GB of memory.
"Next, we consider the system cpdm5, from the repository of systems [25] but originally considered in [6]"
"In the article [20], Morrison and Swinarski study a polynomial system with 13 equations, having 51 isolated solutions."
"A more specialized sort of homotopy, the 2-homogeneous homotopy [24], performs even better in this case."
"Computing the numerical irreducible decomposition [3,24], the solution set consists of 10 irreducible components of various dimensions"
"As a final example, we consider the nine-point four-bar design problem, exactly as formulated in Chapter 5 of [3]"
The regenerative cascade of [10] provides an equation-by-equation approach to computing the numerical irreducible decomposition of the solution set of a polynomial system.
"Parameter homotopies are the right tool for this job, as described briefly in Section 2.1. This idea has been implemented in Bertini [2] and Paramotopy [4]. Some background may be found in [19,17]"
"The trick to such methods is choosing an intermediate system f(v,pË) which satisfies some necessary properties, including that the solutions are smooth. The cheaters homotopy in [17] addresses this issue by including the same perturbation parameter as in Lemma 3.2."
"The numerical irreducible decomposition is the data type used in numerical algebraic geometry to store positive-dimensional solution sets. The technical definition is not necessary here but may be found in [3,24]. "
" If desired, monodromy and the trace test [3,23] could be used to find dZ points on each component Z"
"However, the introduced class of multivariate FayâHerriot models does not contain the Rao and Yu (1994) model or the GonzÃ¡lez-Manteiga etÂ al. (2008b) model as special cases."
"As Chalmers (1995) has noted: “The really hard problem of consciousness is the problem of  experience. When we think and perceive, there is a whir of information-processing, but there is also a subjective aspect."
"As Nagel (1974) has put it, there is  something it is like  to be a conscious organism. This subjective aspect is experience."
"Indeed, early mathematical results about the brain’s functional units of short-term memory (STM) and long-term memory (LTM) proved that the functional units of both STM and LTM are distributed patterns across networks of feature-selective cells (Grossberg, 1968a, 1968b, 1973). "
"ART predicts that all brain representations that solve the stability–plasticity dilemma use variations of CLEARS mechanisms (Grossberg, 1978a, 1980, 2007, 2013a)."
"Since ART was introduced in Grossberg (1976a, 1976b), it has undergone continual development to explain and predict increasingly large behavioral and neurobiological databases, ranging from normal and abnormal aspects of human and animal perception and cognition, to the spiking and oscillatory dynamics of hierarchically-organized laminar thalamocortical and corticocortical networks in multiple modalities. "
"The first paradigm is called Complementary Computing (Grossberg, 2000a). "
"Likewise, because excitatory matching is needed to generate resonances that support conscious internal representations, spatial and motor processes (“procedural memories”; Cohen & Squire, 1980; Mishkin, 1982; Scoville & Milner, 1957; Squire & Cohen, 1984) that use inhibitory matching cannot generate conscious internal representations."
"Perhaps the most basic fact about 3D vision and figure-ground perception is that its functional units are 3D boundaries and surfaces, where these words need to be properly understood. These processes were first modeled in Grossberg (1984a) and have provided a foundation for subsequent explanations and predictions about many data, including how looking at 2D pictures can generate conscious 3D percepts of occluding and occluded objects "
"Neon color spreading was reported in Varin (1971), who studied a “chromatic spreading” effect that was induced when viewing an image similar to the one "
"In summary, end gaps and end cuts are formed as a result of two successive stages of spatial and orientational competition between contrast-sensitive and orientationally tuned boundary cells (Grossberg, 1984a; Grossberg & Mingolla, 1985)."
"These orientationally-tuned simple cells  (Hubel & Wiesel, 1968) can respond to an oriented distribution of contrasts in response to scenic lines, edges, textures, and shading, not just edges alone (Fig. 4(a)). If the brain did use specialized detectors like edge detectors, then it would require many different types of specialized detectors, followed by complicated subsequent processing to try to fuse together all their information. Such an endeavor would fail if only because, in many natural scenes, lines, edges, textures, and shading are all overlaid."
"They cannot discriminate between dark-light and light-dark contrasts, or red–green and green–red contrasts, or blue–yellow and yellow–blue contrasts, because they pool together inputs from simple cells that are sensitive to all of these differences (Thorell, De Valois, & Albrecht, 1984) to form the best possible boundaries"
"These boundary completion cells are often called bipole cells (Cohen & Grossberg, 1984; Grossberg, 1984a; Grossberg & Mingolla, 1985) because they complete boundaries inwardly in an oriented manner between pairs (bipoles!) of boundary inducers. "
"More recently, Brincat and Miller (2015) have reported neurophysiological data that support the distinction between category learning within the attentional system that includes prefrontal cortex, and the orienting system that includes the hippocampus. "
"Among others,Banquet and Grossberg (1987) provide ERP markers during memory search; Brincat and Miller (2015) provide oscillatory neurophysiological markers of the interplay between prefrontal cortex and hippocampus during learning and mismatch; Otto and Eichenbaum (1992) provide neurophysiological data during hippocampal mismatch processing; and Spitzer, Desimone, and Moran (1988) provide neurophysiological data from cortical area V4 during the learning of easy vs. difficult discriminations, a process that is regulated within ART by a vigilance parameter"
"Spitzer et al. (1988) report “in the difficult condition, the animals adopted a stricter internal criterion for discriminating matching from non-matching stimuli…"
"More difficult discriminations, at least under proper circumstances, should lead to higher vigilance, more mismatch events, and thus more of the hippocampal novelty responses found by Brincat and Miller (2015) and Otto and Eichenbaum (1992). "
"Grossberg and Versace (2008), Palma, Grossberg, and Versace (2012), and Palma, Versace, Grossbergand (2012) have furthermore proposed how mismatch-activated acetylcholine release may regulate vigilance in laminar neocortical circuits that are described by spiking neurons during category learning."
"A related set of experiments concerns measuring more carefully what happens during both attentive recognition vs. mismatch reset in response to sequences of familiar vs. unfamiliar cues. Here, the following surprising discovery in Grossberg and Versace (2008) may provide a useful marker"
"In addition, the Lundqvist et al. (2016) article describes modeling ideas in which there is no temporal order represented in working memory, although temporal order information is essential for proper functioning of a working memory."
 The term attentional shroud for such a form-fitting distribution of spatial attention was introduced by Tyler and Kontsevich (1995).
"Kelly and Grossberg (2000) explain stratification percepts, including simulations of their conscious 3D surface percept properties. "
"Grossberg and Yazdanbakhsh (2005)provide model explanations and simulations of these transparency percepts, among others, including simulations of the consciously seen surface percepts, much as the model has simulated 3D surface percepts in response to many other stimuli, including stereogram images "
"Crick and Koch (1995) also proposed that visual awareness may be related to planning of voluntary movements, but without any analysis of how 3D vision occurs. "
"The classical article of Driver and Mattingley (1998) reviews visual neglect properties in individuals who have experienced IPL lesions, particularly in the right hemisphere. The text below takes as explanatory targets properties emphasized in that article"
"A neglect patient who appeared to be blind in the left visual field when fixating straight ahead, or to her left, could detect events in her left visual field when she fixated to the right (Kooistra & Heilman, 1989)."
"The implicit knowledge of parietal patients includes object attributes of neglected stimuli such as their color, shape, identity, and meaning (Mattingley, Bradshaw, & Bradshaw, 1995; McGlinchey-Berroth, Milberg, Verfaellie, Alexander, & Kilduff, 1993)."
"Lesions of the right IPL that cause visual neglect also impair the ability to maintain visual attention over sustained temporal intervals (Rueckert & Grafman, 1998), whether for visual or auditory attention (Robertson et al., 1997). This impairment can be explained by the fact that a surface-shroud resonance maintains spatial attention on an object surface"
"ARTSCAN’s explanation of visual crowding (Foley et al., 2012), and with it an explanation of the Koch and Tsuchiya (2007) discussion of how “subjects can attend to a location for many seconds and yet fail to see one or more attributes of an object at that location” "
"Foley et al. (2012) have supported this qualitative explanation of visual crowding by using the distributed ARTSCAN, or dARTSCAN, model to simulate how objects that have their own shrouds when viewed by the fovea may be enveloped by a single shroud when they are moved to the retinal periphery. "
"That is the main point of the article by Grossberg, Mingolla, and Ross (1994) whose title “A neural theory of attentive visual search: Interactions of boundary, surface, spatial, and object representations” emphasized the role of these four kinds of processes."
"Further experimental and modeling studies of crowding and visual search, and their interactions, from this perspective are much to be desired and, as illustrated by the modeling simulations of Fazl et al. (2009) and Foley et al. (2012), need to include surface-shroud resonances as one part of a unifying theory."
" In one striking classical example, alternating displays of an original and a modified scene are separated in time by brief blank fields (Rensink et al., 1997)."
"This property is called contrast normalization (Grossberg, 1973, 1980; Heeger, 1992). Due to contrast normalization, when attention focuses upon one position, activity decreases at other positions."
Foley et al. (2012) also model why the remainder of a scene does not go totally dark when such a surface-shroud resonance of focused spatial attention forms.
Mitroff and Scholl (2005) showed in this case “that object representations can be formed and updated without awareness” by making changes in displays when they were out of awareness 
Chiu and Yantis (2009) used rapid event-related MRI in humans to provide strong evidence for the ARTSCAN prediction of how a surface-shroud resonance in the Where/How stream protects an emerging view-invariant category from being prematurely reset in the What stream
"In particular, Cao et al. (2011) developed the positional ARTSCAN, or pARTSCAN, extension of the ARTSCAN model to explain how these additional object category invariances can be learned. They have used this extended model to simulate neurophysiological data of Li and DiCarlo (2008; see also Li & DiCarlo, 2010) which show that features from different objects can be merged through learning within a single invariant IT category when monkeys are presented with an object that is swapped with another object during an eye movement to foveate the original object."
"These target positions hereby control shifts of spatial attention across an attended object, and have properties that Cavanagh, Hunt, Afraz, and Rolfs (2010) have called attention pointers"
"This is proposed to occur in cortical area V3A (Fig. 21). As noted by Caplovitz and Tse (2007, p. 1179): “neurons within V3A…process continuously moving contour curvature as a trackable feature…not to solve the ‘ventral problem’ of determining object shape but in order to solve the ‘dorsal problem’ of what is going where”."
"ART proposes that this happens because both resonances interact with shared visual cortical areas, such as V4, and can thus synchronize with each other, often with gamma oscillations (Fries, 2009; Grossberg & Versace, 2008)."
" An outflow representation of the current hand/arm position, called the present position vector, or P, is subtracted from the target position to compute a difference vector, or D (Georgopoulos, Kalaska, Caminiti, & Massey, 1982; Georgopoulos, Schwartz, & Kettner, 1986) that codes the direction and distance that the hand/arm needs to move to reach the target. "
"The Vector Integration to Endpoint, or VITE, model (Fig. 27, left panel; Bullock & Grossberg, 1988) modeled these processes to clarify how the Three S’s of reaching are carried out: the flexible choice of motor Synergies, and their Synchronous performance at variable Speeds."
"A refinement that sheds the most light on auditory–visual homologs of reaching and speaking circuits is called the DIRECT model (Bullock, Grossberg, & Guenther, 1993), which also learns through a circular reaction."
"During the development of the DIRECT model by Bullock et al. (1993), an evolutionary rationale was noted for why both the hand/arm and speech articulator systems may use similar, indeed homologous, neural circuits; namely, eating preceded speech during human evolution (MacNeilage, 1998), and skillful eating requires movements that coordinate hand/arm and mouth/throat articulators, including motor-equivalent solutions for reaching and chewing. "
"The auditory continuity illusion (Bregman, 1990) illustrates ART properties during auditory streaming."
"Grossberg (1978a, 1978b) introduced a neural model of working memory upon which the more recent models listed above consistently built."
"A more recent name for this class of models is competitive queuing (Houghton, 1990). When an Item-and-Order working memory can store repeated items in a sequence, it is called an Item–Order–Rank working memory (Bradski, Carpenter, & Grossberg, 1994; Grossberg & Pearson, 2008; Silver et al., 2011)."
"Phonemic restoration (Warren & Sherman, 1974) illustrates the operation of ART mechanisms during speech perception in much the same way as the auditory continuity illusion represents them during auditory streaming"
"Jones, Farrand, Stuart, and Morris (1995) reported similar performance characteristics to those of verbal working memory for a spatial serial recall task in which visual locations were remembered. "
"Agam, Bullock, and Sekuler (2005) reported psychophysical evidence of Item-and-Order working memory properties in humans as they performed sequential copying movements, and Averbeck et al. (2002); Averbeck, Crowe, Chafee, and Georgopoulos (2003a, 2003b) reported neurophysiological evidence for such a working memory in monkeys during performance of sequential copying movements."
"The motor-to-auditory selection process mechanistically explicates the “motor theory of speech perception” (Galantucci, Fowley, & Turvey, 2006; Liberman & Mattingly, 1985)."
"The Neural Normalization Network, or NormNet, model (Ames & Grossberg, 2008) proposes that speaker normalization specializes the same kinds of neural mechanisms that are used to form auditory streams."
"This proposal clarifies how speaker normalization can transform auditory signals, right after they are separated into separate streams, for purposes of speech and language classification and meaning extraction, yet how the frequency content of the streams can be preserved for purposes of speaker identification in a separate processing stream, as illustrated in the ARTSPEECH architecture (Fig. 33, right panel) of Ames and Grossberg (2008). "
Boardman et al. (1999) developed the PHONET model to quantify how T and S working memories can use asymmetric T-to-S gain control to create rate-invariant representations of individual speech syllables or words. 
"A classical example of this phenomenon was reported by Repp (1980). Repp constructed VC-CV syllables from the syllables [ib], [ga], and [ba] to form [ib]-[ga] and [ib]-[ba]."
The comparison between resonant fusion and resonant reset that plays an important role in explaining the Repp (1980) data on category boundary shifts also helps to explain data about the way in which masking stimuli can influence error rates and reaction times during lexical decision tasks.
"Grossberg and Stone (1986b) explained the paradoxical pattern of experimental results in terms of how the ART Matching Rule works in different priming situations, including the inability of top-down expectations to act before the mask interferes with the persistence of word and non-word target representations in working memory"
"The TELOS model (Brown et al., 2004) predicted how agreement between prefrontal and parietal representations of a target position causes a parietal–prefrontal resonance that selects this target position, and opens the correct basal ganglia gate, while also enabling basal ganglia-mediated release, in a different part of the brain, of a contextually-appropriate movement command to that position."
"Subsequent neurophysiological data of Buschman and Miller (2007)supported this prediction by describing such a parietal–prefrontal resonance during movement control, and Pasupathy and Miller (2004) additionally described different time courses of activation in the prefrontal cortex and basal ganglia that are consistent with how basal ganglia-mediated gating of prefrontal cortex occurs in TELOS."
"The lisTELOS model (Silver et al., 2011) extended the TELOS model to explain and predict how sequences, or lists, of eye movements can be carried out, while continuing to simulate everything that TELOS could. "
"On the other hand, it does propose how parallel neural mechanisms for rate-invariant and speaker-normalized representations of speech, and for pitch-dependent and rhythm-dependent speech intonation (Ladefoged & Disner, 2012), may interact to achieve “online sequencing of syllables into fast, smooth, and rhythmically organized larger utterances” (Ackerman, 2008, p. 265), including how these several kinds of information are learned, stored, and combined during fluent performance and conscious awareness thereof. "
"Learning also goes on throughout life of a parallel circular reaction that links learned spectral-pitch-and-timbre categories for the recognition of heard sounds (Table 2), which are not speaker-normalized, to the motor synergies that control the pitches generated by the vocal folds (Sundberg, 1977)."
"Neural models of cognitive–emotional resonances began with the articles of Grossberg (1971, 1972a, 1972b) and Grossberg (1975) at a time when there was a major split between studies of cognition, as exemplified by the work of Chomsky (1957) in linguistics, and of emotion, as exemplified by the work of Skinner (1938) on instrumental conditioning."
"For simplicity, consider only the simplest kind of reinforcement learning, called Pavlovian or classical conditioning (Kamin, 1968, 1969; Pavlov, 1927), during which a conditioned stimulus, or CS, that initially may have no emotional significance, is paired with an unconditioned stimulus, or US, that can from the start generate a strong emotional response. "
"Damasio (1999) has derived from clinical data what can be viewed as a heuristic version of the CogEM model, and has used it to describe what can be interpreted as cognitive–emotional resonances that support “the feeling of what happens”. "
"Damasio (1999, p. 171), notes: “Attention is driven to focus on an object and the result is saliency of the images of that object in mind”, leading to what Damasio calls core consciousness. Damasio (1999) also went on to write “I do not know how the fusing, blending, and smoothing are achieved…” (p. 180). "
"These include the “dual competition” model of Pessoa (2009, p. 160): “The proposed framework is referred to as the ‘dual competition’ model to reflect the suggestion that affective significance influences competition at both the perceptual and executive levels—and because the impact is caused by both emotion and motivation”."
"The ARTSCENE model (Grossberg & Huang, 2009) and ARTSCENE Search model (Huang & Grossberg, 2010) illustrate how humans accomplish these goals."
"Tamietto and de Gelder (2010) have reviewed several different kinds of experimental evidence that led them to a similar viewpoint, but without mechanisms of adaptive resonance to derive mechanistic conclusions. "
